{
  "__type__": "sp.SkeletonData",
  "_name": "spine",
  "_skeletonJson": {
    "skeleton": {
      "hash": "KxOJrYMkHXq8Oac0eHSpRKFk9w4",
      "spine": "3.6.53",
      "width": 184,
      "height": 179,
      "images": "./img/"
    },
    "bones": [
      {
        "name": "root"
      },
      {
        "name": "paopaoposui_1",
        "parent": "root"
      },
      {
        "name": "theme114_base_bubble",
        "parent": "root"
      }
    ],
    "slots": [
      {
        "name": "paopaoposui/paopaoposui_1",
        "bone": "paopaoposui_1",
        "attachment": "paopaoposui/paopaoposui_9"
      },
      {
        "name": "theme114_base_bubble",
        "bone": "theme114_base_bubble",
        "attachment": "theme114_base_bubble"
      }
    ],
    "skins": {
      "default": {
        "paopaoposui/paopaoposui_1": {
          "paopaoposui/paopaoposui_1": {
            "width": 142,
            "height": 130
          },
          "paopaoposui/paopaoposui_2": {
            "width": 148,
            "height": 139
          },
          "paopaoposui/paopaoposui_3": {
            "width": 158,
            "height": 149
          },
          "paopaoposui/paopaoposui_4": {
            "width": 167,
            "height": 155
          },
          "paopaoposui/paopaoposui_5": {
            "width": 174,
            "height": 160
          },
          "paopaoposui/paopaoposui_6": {
            "width": 180,
            "height": 165
          },
          "paopaoposui/paopaoposui_7": {
            "width": 186,
            "height": 172
          },
          "paopaoposui/paopaoposui_8": {
            "width": 191,
            "height": 179
          },
          "paopaoposui/paopaoposui_9": {
            "width": 184,
            "height": 179
          },
          "paopaoposui/paopaoposui_10": {
            "width": 188,
            "height": 182
          },
          "paopaoposui/paopaoposui_11": {
            "width": 191,
            "height": 186
          },
          "paopaoposui/paopaoposui_12": {
            "width": 193,
            "height": 188
          },
          "paopaoposui/paopaoposui_13": {
            "width": 181,
            "height": 188
          },
          "paopaoposui/paopaoposui_14": {
            "width": 169,
            "height": 178
          }
        },
        "theme114_base_bubble": {
          "theme114_base_bubble": {
            "width": 160,
            "height": 160
          }
        }
      }
    },
    "animations": {
      "animation01": {
        "slots": {
          "paopaoposui/paopaoposui_1": {
            "attachment": [
              {
                "time": 0,
                "name": null
              }
            ]
          }
        },
        "bones": {
          "theme114_base_bubble": {
            "translate": [
              {
                "time": 0,
                "x": 0,
                "y": 0,
                "curve": [
                  0.25,
                  0,
                  0.75,
                  1
                ]
              },
              {
                "time": 0.6667,
                "x": -10,
                "y": 0,
                "curve": [
                  0.25,
                  0,
                  0.75,
                  1
                ]
              },
              {
                "time": 1.3333,
                "x": 0,
                "y": 0
              }
            ]
          }
        }
      },
      "animation02": {
        "slots": {
          "paopaoposui/paopaoposui_1": {
            "attachment": [
              {
                "time": 0,
                "name": null
              }
            ]
          }
        },
        "bones": {
          "theme114_base_bubble": {
            "translate": [
              {
                "time": 0,
                "x": 0,
                "y": 0,
                "curve": [
                  0.25,
                  0,
                  0.75,
                  1
                ]
              },
              {
                "time": 0.6667,
                "x": 10,
                "y": 0,
                "curve": [
                  0.25,
                  0,
                  0.75,
                  1
                ]
              },
              {
                "time": 1.3333,
                "x": 0,
                "y": 0
              }
            ]
          }
        }
      },
      "animation03": {
        "slots": {
          "paopaoposui/paopaoposui_1": {
            "attachment": [
              {
                "time": 0,
                "name": "paopaoposui/paopaoposui_1"
              },
              {
                "time": 0.0667,
                "name": "paopaoposui/paopaoposui_2"
              },
              {
                "time": 0.1,
                "name": "paopaoposui/paopaoposui_3"
              },
              {
                "time": 0.1333,
                "name": "paopaoposui/paopaoposui_4"
              },
              {
                "time": 0.1667,
                "name": "paopaoposui/paopaoposui_5"
              },
              {
                "time": 0.2,
                "name": "paopaoposui/paopaoposui_6"
              },
              {
                "time": 0.2333,
                "name": "paopaoposui/paopaoposui_7"
              },
              {
                "time": 0.2667,
                "name": "paopaoposui/paopaoposui_8"
              },
              {
                "time": 0.3,
                "name": "paopaoposui/paopaoposui_9"
              },
              {
                "time": 0.3333,
                "name": "paopaoposui/paopaoposui_10"
              },
              {
                "time": 0.3667,
                "name": "paopaoposui/paopaoposui_11"
              },
              {
                "time": 0.4,
                "name": "paopaoposui/paopaoposui_12"
              },
              {
                "time": 0.4333,
                "name": "paopaoposui/paopaoposui_13"
              },
              {
                "time": 0.4667,
                "name": "paopaoposui/paopaoposui_14"
              },
              {
                "time": 0.5,
                "name": null
              }
            ]
          },
          "theme114_base_bubble": {
            "attachment": [
              {
                "time": 0,
                "name": null
              }
            ]
          }
        },
        "bones": {
          "paopaoposui_1": {
            "scale": [
              {
                "time": 0,
                "x": 1.566,
                "y": 1.566
              },
              {
                "time": 0.5,
                "x": 1.534,
                "y": 1.534
              }
            ]
          }
        }
      }
    }
  },
  "_atlasText": "\nspine.png\nsize: 1024,512\nformat: RGBA8888\nfilter: Linear,Linear\nrepeat: none\npaopaoposui/paopaoposui_1\n  rotate: false\n  xy: 1, 4\n  size: 142, 129\n  orig: 142, 130\n  offset: 0, 0\n  index: -1\npaopaoposui/paopaoposui_10\n  rotate: false\n  xy: 387, 327\n  size: 188, 182\n  orig: 188, 182\n  offset: 0, 0\n  index: -1\npaopaoposui/paopaoposui_11\n  rotate: false\n  xy: 1, 134\n  size: 191, 186\n  orig: 191, 186\n  offset: 0, 0\n  index: -1\npaopaoposui/paopaoposui_12\n  rotate: false\n  xy: 1, 321\n  size: 193, 188\n  orig: 193, 188\n  offset: 0, 0\n  index: -1\npaopaoposui/paopaoposui_13\n  rotate: true\n  xy: 576, 328\n  size: 181, 188\n  orig: 181, 188\n  offset: 0, 0\n  index: -1\npaopaoposui/paopaoposui_14\n  rotate: true\n  xy: 382, 157\n  size: 169, 178\n  orig: 169, 178\n  offset: 0, 0\n  index: -1\npaopaoposui/paopaoposui_2\n  rotate: true\n  xy: 520, 8\n  size: 148, 139\n  orig: 148, 139\n  offset: 0, 0\n  index: -1\npaopaoposui/paopaoposui_3\n  rotate: false\n  xy: 361, 7\n  size: 158, 149\n  orig: 158, 149\n  offset: 0, 0\n  index: -1\npaopaoposui/paopaoposui_4\n  rotate: false\n  xy: 193, 1\n  size: 167, 155\n  orig: 167, 155\n  offset: 0, 0\n  index: -1\npaopaoposui/paopaoposui_5\n  rotate: false\n  xy: 660, 3\n  size: 174, 160\n  orig: 174, 160\n  offset: 0, 0\n  index: -1\npaopaoposui/paopaoposui_6\n  rotate: false\n  xy: 765, 164\n  size: 180, 165\n  orig: 180, 165\n  offset: 0, 0\n  index: -1\npaopaoposui/paopaoposui_7\n  rotate: false\n  xy: 195, 157\n  size: 186, 172\n  orig: 186, 172\n  offset: 0, 0\n  index: -1\npaopaoposui/paopaoposui_8\n  rotate: false\n  xy: 195, 330\n  size: 191, 179\n  orig: 191, 179\n  offset: 0, 0\n  index: -1\npaopaoposui/paopaoposui_9\n  rotate: false\n  xy: 765, 330\n  size: 184, 179\n  orig: 184, 179\n  offset: 0, 0\n  index: -1\ntheme114_base_bubble\n  rotate: false\n  xy: 835, 3\n  size: 160, 160\n  orig: 160, 160\n  offset: 0, 0\n  index: -1\n",
  "textures": [
    {
      "__uuid__": "fbtdb3PbdHMJUsyX5JnCSl"
    }
  ],
  "textureNames": [
    "spine.png"
  ]
}