{
  "__type__": "sp.SkeletonData",
  "_name": "zhuanshi_01",
  "_skeletonJson": {
    "skeleton": {
      "hash": "fyEYC3a9Q0jGgtVot6oCksKVljs",
      "spine": "3.6.53",
      "width": 930,
      "height": 1104,
      "images": "../texiao/"
    },
    "bones": [
      {
        "name": "root"
      },
      {
        "name": "zs",
        "parent": "root"
      },
      {
        "name": "hong",
        "parent": "zs"
      },
      {
        "name": "hongxulie",
        "parent": "hong"
      },
      {
        "name": "gaoliang01",
        "parent": "hongxulie",
        "scaleX": 3,
        "scaleY": 3
      },
      {
        "name": "lanxulie",
        "parent": "hong"
      },
      {
        "name": "gaoliang02",
        "parent": "lanxulie",
        "scaleX": 2,
        "scaleY": 2
      },
      {
        "name": "lvxulie",
        "parent": "hong"
      },
      {
        "name": "gaoliang03",
        "parent": "lvxulie",
        "scaleX": 2,
        "scaleY": 2
      },
      {
        "name": "tongyong",
        "parent": "hong",
        "x": 40.79,
        "y": -10.2
      },
      {
        "name": "guangci01",
        "parent": "tongyong",
        "x": -40.53,
        "y": 11.39,
        "scaleX": 6,
        "scaleY": 6
      },
      {
        "name": "guangci1",
        "parent": "tongyong",
        "x": -40.53,
        "y": 11.39,
        "scaleX": 6,
        "scaleY": 6
      },
      {
        "name": "hongzuanshi_liuguang1",
        "parent": "hongxulie",
        "scaleX": 3,
        "scaleY": 3
      },
      {
        "name": "hongzuanshi_liuguang2",
        "parent": "hongxulie",
        "scaleX": 3,
        "scaleY": 3
      },
      {
        "name": "lanzuanshi_liuguang1",
        "parent": "lanxulie",
        "scaleX": 2.21,
        "scaleY": 2.21
      },
      {
        "name": "lanzuanshi_liuguang2",
        "parent": "lanxulie",
        "scaleX": 2.21,
        "scaleY": 2.21
      },
      {
        "name": "lvzuanshi_liuguang1",
        "parent": "lvxulie",
        "scaleX": 2,
        "scaleY": 2
      },
      {
        "name": "lvzuanshi_liuguang2",
        "parent": "lvxulie",
        "scaleX": 2,
        "scaleY": 2
      }
    ],
    "slots": [
      {
        "name": "guangci01",
        "bone": "guangci01",
        "attachment": "guangci01",
        "blend": "additive"
      },
      {
        "name": "guangci1",
        "bone": "guangci1",
        "attachment": "guangci01",
        "blend": "additive"
      },
      {
        "name": "hong",
        "bone": "hong",
        "attachment": "hong"
      },
      {
        "name": "gaoliang01",
        "bone": "gaoliang01",
        "attachment": "gaoliang01",
        "blend": "additive"
      },
      {
        "name": "gaoliang1",
        "bone": "gaoliang01",
        "attachment": "gaoliang01",
        "blend": "additive"
      },
      {
        "name": "hongzuanshi_liuguang1/hongzuanshi_liuguang1_1",
        "bone": "hongzuanshi_liuguang1",
        "attachment": "hongzuanshi_liuguang1/hongzuanshi_liuguang1_9",
        "blend": "additive"
      },
      {
        "name": "hongzuanshi_liuguang2/hongzuanshi_liuguang2_1",
        "bone": "hongzuanshi_liuguang2",
        "attachment": "hongzuanshi_liuguang2/hongzuanshi_liuguang2_9",
        "blend": "additive"
      },
      {
        "name": "lanzuanshi_liuguang1/lanzuanshi_liuguang1_1",
        "bone": "lanzuanshi_liuguang1",
        "attachment": "lanzuanshi_liuguang1/lanzuanshi_liuguang1_1",
        "blend": "additive"
      },
      {
        "name": "lanzuanshi_liuguang2/lanzuanshi_liuguang2_1",
        "bone": "lanzuanshi_liuguang2",
        "attachment": "lanzuanshi_liuguang2/lanzuanshi_liuguang2_1",
        "blend": "additive"
      },
      {
        "name": "gaoliang02",
        "bone": "gaoliang02",
        "attachment": "gaoliang02",
        "blend": "additive"
      },
      {
        "name": "gaoliang2",
        "bone": "gaoliang02",
        "attachment": "gaoliang02",
        "blend": "additive"
      },
      {
        "name": "lvzuanshi_liuguang1/lvzuanshi_liuguang1_1",
        "bone": "lvzuanshi_liuguang1",
        "attachment": "lvzuanshi_liuguang1/lvzuanshi_liuguang1_9",
        "blend": "additive"
      },
      {
        "name": "lvzuanshi_liuguang2/lvzuanshi_liuguang2_1",
        "bone": "lvzuanshi_liuguang2",
        "attachment": "lvzuanshi_liuguang2/lvzuanshi_liuguang2_1",
        "blend": "additive"
      },
      {
        "name": "gaoliang03",
        "bone": "gaoliang03",
        "attachment": "gaoliang03",
        "blend": "additive"
      },
      {
        "name": "gaoliang3",
        "bone": "gaoliang03",
        "attachment": "gaoliang03",
        "blend": "additive"
      }
    ],
    "skins": {
      "default": {
        "gaoliang01": {
          "gaoliang01": {
            "width": 100,
            "height": 97
          }
        },
        "gaoliang02": {
          "gaoliang02": {
            "width": 98,
            "height": 97
          }
        },
        "gaoliang03": {
          "gaoliang03": {
            "width": 90,
            "height": 88
          }
        },
        "gaoliang1": {
          "gaoliang01": {
            "width": 100,
            "height": 97
          }
        },
        "gaoliang2": {
          "gaoliang02": {
            "width": 98,
            "height": 97
          }
        },
        "gaoliang3": {
          "gaoliang03": {
            "width": 90,
            "height": 88
          }
        },
        "guangci01": {
          "guangci01": {
            "x": -6.15,
            "y": 0.64,
            "width": 155,
            "height": 184
          }
        },
        "guangci1": {
          "guangci01": {
            "x": -6.15,
            "y": 0.64,
            "width": 155,
            "height": 184
          }
        },
        "hong": {
          "hong": {
            "width": 157,
            "height": 152
          },
          "lan": {
            "width": 154,
            "height": 154
          },
          "lv": {
            "width": 126,
            "height": 124
          }
        },
        "hongzuanshi_liuguang1/hongzuanshi_liuguang1_1": {
          "hongzuanshi_liuguang1/hongzuanshi_liuguang1_1": {
            "width": 58,
            "height": 54
          },
          "hongzuanshi_liuguang1/hongzuanshi_liuguang1_2": {
            "width": 58,
            "height": 54
          },
          "hongzuanshi_liuguang1/hongzuanshi_liuguang1_3": {
            "width": 58,
            "height": 54
          },
          "hongzuanshi_liuguang1/hongzuanshi_liuguang1_4": {
            "width": 58,
            "height": 54
          },
          "hongzuanshi_liuguang1/hongzuanshi_liuguang1_5": {
            "width": 58,
            "height": 54
          },
          "hongzuanshi_liuguang1/hongzuanshi_liuguang1_6": {
            "width": 58,
            "height": 54
          },
          "hongzuanshi_liuguang1/hongzuanshi_liuguang1_7": {
            "width": 58,
            "height": 54
          },
          "hongzuanshi_liuguang1/hongzuanshi_liuguang1_8": {
            "width": 58,
            "height": 54
          },
          "hongzuanshi_liuguang1/hongzuanshi_liuguang1_9": {
            "width": 58,
            "height": 54
          },
          "hongzuanshi_liuguang1/hongzuanshi_liuguang1_10": {
            "width": 58,
            "height": 54
          },
          "hongzuanshi_liuguang1/hongzuanshi_liuguang1_11": {
            "width": 58,
            "height": 54
          },
          "hongzuanshi_liuguang1/hongzuanshi_liuguang1_12": {
            "width": 58,
            "height": 54
          },
          "hongzuanshi_liuguang1/hongzuanshi_liuguang1_13": {
            "width": 58,
            "height": 54
          },
          "hongzuanshi_liuguang1/hongzuanshi_liuguang1_14": {
            "width": 58,
            "height": 54
          },
          "hongzuanshi_liuguang1/hongzuanshi_liuguang1_15": {
            "width": 58,
            "height": 54
          },
          "hongzuanshi_liuguang1/hongzuanshi_liuguang1_16": {
            "width": 58,
            "height": 54
          },
          "hongzuanshi_liuguang1/hongzuanshi_liuguang1_17": {
            "width": 58,
            "height": 54
          },
          "hongzuanshi_liuguang1/hongzuanshi_liuguang1_18": {
            "width": 58,
            "height": 54
          },
          "hongzuanshi_liuguang1/hongzuanshi_liuguang1_19": {
            "width": 58,
            "height": 54
          }
        },
        "hongzuanshi_liuguang2/hongzuanshi_liuguang2_1": {
          "hongzuanshi_liuguang2/hongzuanshi_liuguang2_1": {
            "width": 58,
            "height": 54
          },
          "hongzuanshi_liuguang2/hongzuanshi_liuguang2_2": {
            "width": 58,
            "height": 54
          },
          "hongzuanshi_liuguang2/hongzuanshi_liuguang2_3": {
            "width": 58,
            "height": 54
          },
          "hongzuanshi_liuguang2/hongzuanshi_liuguang2_4": {
            "width": 58,
            "height": 54
          },
          "hongzuanshi_liuguang2/hongzuanshi_liuguang2_5": {
            "width": 58,
            "height": 54
          },
          "hongzuanshi_liuguang2/hongzuanshi_liuguang2_6": {
            "width": 58,
            "height": 54
          },
          "hongzuanshi_liuguang2/hongzuanshi_liuguang2_7": {
            "width": 58,
            "height": 54
          },
          "hongzuanshi_liuguang2/hongzuanshi_liuguang2_8": {
            "width": 58,
            "height": 54
          },
          "hongzuanshi_liuguang2/hongzuanshi_liuguang2_9": {
            "width": 58,
            "height": 54
          },
          "hongzuanshi_liuguang2/hongzuanshi_liuguang2_10": {
            "width": 58,
            "height": 54
          },
          "hongzuanshi_liuguang2/hongzuanshi_liuguang2_11": {
            "width": 58,
            "height": 54
          },
          "hongzuanshi_liuguang2/hongzuanshi_liuguang2_12": {
            "width": 58,
            "height": 54
          },
          "hongzuanshi_liuguang2/hongzuanshi_liuguang2_13": {
            "width": 58,
            "height": 54
          },
          "hongzuanshi_liuguang2/hongzuanshi_liuguang2_14": {
            "width": 58,
            "height": 54
          },
          "hongzuanshi_liuguang2/hongzuanshi_liuguang2_15": {
            "width": 58,
            "height": 54
          },
          "hongzuanshi_liuguang2/hongzuanshi_liuguang2_16": {
            "width": 58,
            "height": 54
          },
          "hongzuanshi_liuguang2/hongzuanshi_liuguang2_17": {
            "width": 58,
            "height": 54
          },
          "hongzuanshi_liuguang2/hongzuanshi_liuguang2_18": {
            "width": 58,
            "height": 54
          },
          "hongzuanshi_liuguang2/hongzuanshi_liuguang2_19": {
            "width": 58,
            "height": 54
          },
          "hongzuanshi_liuguang2/hongzuanshi_liuguang2_20": {
            "width": 58,
            "height": 54
          },
          "hongzuanshi_liuguang2/hongzuanshi_liuguang2_21": {
            "width": 58,
            "height": 54
          },
          "hongzuanshi_liuguang2/hongzuanshi_liuguang2_22": {
            "width": 58,
            "height": 54
          },
          "hongzuanshi_liuguang2/hongzuanshi_liuguang2_23": {
            "width": 58,
            "height": 54
          },
          "hongzuanshi_liuguang2/hongzuanshi_liuguang2_24": {
            "width": 58,
            "height": 54
          }
        },
        "lanzuanshi_liuguang1/lanzuanshi_liuguang1_1": {
          "lanzuanshi_liuguang1/lanzuanshi_liuguang1_1": {
            "width": 58,
            "height": 54
          },
          "lanzuanshi_liuguang1/lanzuanshi_liuguang1_2": {
            "width": 58,
            "height": 54
          },
          "lanzuanshi_liuguang1/lanzuanshi_liuguang1_3": {
            "width": 58,
            "height": 54
          },
          "lanzuanshi_liuguang1/lanzuanshi_liuguang1_4": {
            "width": 58,
            "height": 54
          },
          "lanzuanshi_liuguang1/lanzuanshi_liuguang1_5": {
            "width": 58,
            "height": 54
          },
          "lanzuanshi_liuguang1/lanzuanshi_liuguang1_6": {
            "width": 58,
            "height": 54
          },
          "lanzuanshi_liuguang1/lanzuanshi_liuguang1_7": {
            "width": 58,
            "height": 54
          },
          "lanzuanshi_liuguang1/lanzuanshi_liuguang1_8": {
            "width": 58,
            "height": 54
          },
          "lanzuanshi_liuguang1/lanzuanshi_liuguang1_9": {
            "width": 58,
            "height": 54
          },
          "lanzuanshi_liuguang1/lanzuanshi_liuguang1_10": {
            "width": 58,
            "height": 54
          },
          "lanzuanshi_liuguang1/lanzuanshi_liuguang1_11": {
            "width": 58,
            "height": 54
          },
          "lanzuanshi_liuguang1/lanzuanshi_liuguang1_12": {
            "width": 58,
            "height": 54
          },
          "lanzuanshi_liuguang1/lanzuanshi_liuguang1_13": {
            "width": 58,
            "height": 54
          },
          "lanzuanshi_liuguang1/lanzuanshi_liuguang1_14": {
            "width": 58,
            "height": 54
          },
          "lanzuanshi_liuguang1/lanzuanshi_liuguang1_15": {
            "width": 58,
            "height": 54
          },
          "lanzuanshi_liuguang1/lanzuanshi_liuguang1_16": {
            "width": 58,
            "height": 54
          },
          "lanzuanshi_liuguang1/lanzuanshi_liuguang1_17": {
            "width": 58,
            "height": 54
          },
          "lanzuanshi_liuguang1/lanzuanshi_liuguang1_18": {
            "width": 58,
            "height": 54
          },
          "lanzuanshi_liuguang1/lanzuanshi_liuguang1_19": {
            "width": 58,
            "height": 54
          }
        },
        "lanzuanshi_liuguang2/lanzuanshi_liuguang2_1": {
          "lanzuanshi_liuguang2/lanzuanshi_liuguang2_1": {
            "width": 58,
            "height": 54
          },
          "lanzuanshi_liuguang2/lanzuanshi_liuguang2_2": {
            "width": 58,
            "height": 54
          },
          "lanzuanshi_liuguang2/lanzuanshi_liuguang2_3": {
            "width": 58,
            "height": 54
          },
          "lanzuanshi_liuguang2/lanzuanshi_liuguang2_4": {
            "width": 58,
            "height": 54
          },
          "lanzuanshi_liuguang2/lanzuanshi_liuguang2_5": {
            "width": 58,
            "height": 54
          },
          "lanzuanshi_liuguang2/lanzuanshi_liuguang2_6": {
            "width": 58,
            "height": 54
          },
          "lanzuanshi_liuguang2/lanzuanshi_liuguang2_7": {
            "width": 58,
            "height": 54
          },
          "lanzuanshi_liuguang2/lanzuanshi_liuguang2_8": {
            "width": 58,
            "height": 54
          },
          "lanzuanshi_liuguang2/lanzuanshi_liuguang2_9": {
            "width": 58,
            "height": 54
          },
          "lanzuanshi_liuguang2/lanzuanshi_liuguang2_10": {
            "width": 58,
            "height": 54
          },
          "lanzuanshi_liuguang2/lanzuanshi_liuguang2_11": {
            "width": 58,
            "height": 54
          },
          "lanzuanshi_liuguang2/lanzuanshi_liuguang2_12": {
            "width": 58,
            "height": 54
          },
          "lanzuanshi_liuguang2/lanzuanshi_liuguang2_13": {
            "width": 58,
            "height": 54
          },
          "lanzuanshi_liuguang2/lanzuanshi_liuguang2_14": {
            "width": 58,
            "height": 54
          },
          "lanzuanshi_liuguang2/lanzuanshi_liuguang2_15": {
            "width": 58,
            "height": 54
          },
          "lanzuanshi_liuguang2/lanzuanshi_liuguang2_16": {
            "width": 58,
            "height": 54
          },
          "lanzuanshi_liuguang2/lanzuanshi_liuguang2_17": {
            "width": 58,
            "height": 54
          },
          "lanzuanshi_liuguang2/lanzuanshi_liuguang2_18": {
            "width": 58,
            "height": 54
          },
          "lanzuanshi_liuguang2/lanzuanshi_liuguang2_19": {
            "width": 58,
            "height": 54
          },
          "lanzuanshi_liuguang2/lanzuanshi_liuguang2_20": {
            "width": 58,
            "height": 54
          },
          "lanzuanshi_liuguang2/lanzuanshi_liuguang2_21": {
            "width": 58,
            "height": 54
          },
          "lanzuanshi_liuguang2/lanzuanshi_liuguang2_22": {
            "width": 58,
            "height": 54
          },
          "lanzuanshi_liuguang2/lanzuanshi_liuguang2_23": {
            "width": 58,
            "height": 54
          },
          "lanzuanshi_liuguang2/lanzuanshi_liuguang2_24": {
            "width": 58,
            "height": 54
          }
        },
        "lvzuanshi_liuguang1/lvzuanshi_liuguang1_1": {
          "lvzuanshi_liuguang1/lvzuanshi_liuguang1_1": {
            "width": 58,
            "height": 54
          },
          "lvzuanshi_liuguang1/lvzuanshi_liuguang1_2": {
            "width": 58,
            "height": 54
          },
          "lvzuanshi_liuguang1/lvzuanshi_liuguang1_3": {
            "width": 58,
            "height": 54
          },
          "lvzuanshi_liuguang1/lvzuanshi_liuguang1_4": {
            "width": 58,
            "height": 54
          },
          "lvzuanshi_liuguang1/lvzuanshi_liuguang1_5": {
            "width": 58,
            "height": 54
          },
          "lvzuanshi_liuguang1/lvzuanshi_liuguang1_6": {
            "width": 58,
            "height": 54
          },
          "lvzuanshi_liuguang1/lvzuanshi_liuguang1_7": {
            "width": 58,
            "height": 54
          },
          "lvzuanshi_liuguang1/lvzuanshi_liuguang1_8": {
            "width": 58,
            "height": 54
          },
          "lvzuanshi_liuguang1/lvzuanshi_liuguang1_9": {
            "width": 58,
            "height": 54
          },
          "lvzuanshi_liuguang1/lvzuanshi_liuguang1_10": {
            "width": 58,
            "height": 54
          },
          "lvzuanshi_liuguang1/lvzuanshi_liuguang1_11": {
            "width": 58,
            "height": 54
          },
          "lvzuanshi_liuguang1/lvzuanshi_liuguang1_12": {
            "width": 58,
            "height": 54
          },
          "lvzuanshi_liuguang1/lvzuanshi_liuguang1_13": {
            "width": 58,
            "height": 54
          },
          "lvzuanshi_liuguang1/lvzuanshi_liuguang1_14": {
            "width": 58,
            "height": 54
          },
          "lvzuanshi_liuguang1/lvzuanshi_liuguang1_15": {
            "width": 58,
            "height": 54
          },
          "lvzuanshi_liuguang1/lvzuanshi_liuguang1_16": {
            "width": 58,
            "height": 54
          }
        },
        "lvzuanshi_liuguang2/lvzuanshi_liuguang2_1": {
          "lvzuanshi_liuguang2/lvzuanshi_liuguang2_1": {
            "width": 58,
            "height": 54
          },
          "lvzuanshi_liuguang2/lvzuanshi_liuguang2_2": {
            "width": 58,
            "height": 54
          },
          "lvzuanshi_liuguang2/lvzuanshi_liuguang2_3": {
            "width": 58,
            "height": 54
          },
          "lvzuanshi_liuguang2/lvzuanshi_liuguang2_4": {
            "width": 58,
            "height": 54
          },
          "lvzuanshi_liuguang2/lvzuanshi_liuguang2_5": {
            "width": 58,
            "height": 54
          },
          "lvzuanshi_liuguang2/lvzuanshi_liuguang2_6": {
            "width": 58,
            "height": 54
          },
          "lvzuanshi_liuguang2/lvzuanshi_liuguang2_7": {
            "width": 58,
            "height": 54
          },
          "lvzuanshi_liuguang2/lvzuanshi_liuguang2_8": {
            "width": 58,
            "height": 54
          },
          "lvzuanshi_liuguang2/lvzuanshi_liuguang2_9": {
            "width": 58,
            "height": 54
          },
          "lvzuanshi_liuguang2/lvzuanshi_liuguang2_10": {
            "width": 58,
            "height": 54
          },
          "lvzuanshi_liuguang2/lvzuanshi_liuguang2_11": {
            "width": 58,
            "height": 54
          },
          "lvzuanshi_liuguang2/lvzuanshi_liuguang2_12": {
            "width": 58,
            "height": 54
          },
          "lvzuanshi_liuguang2/lvzuanshi_liuguang2_13": {
            "width": 58,
            "height": 54
          },
          "lvzuanshi_liuguang2/lvzuanshi_liuguang2_14": {
            "width": 58,
            "height": 54
          },
          "lvzuanshi_liuguang2/lvzuanshi_liuguang2_15": {
            "width": 58,
            "height": 54
          },
          "lvzuanshi_liuguang2/lvzuanshi_liuguang2_16": {
            "width": 58,
            "height": 54
          },
          "lvzuanshi_liuguang2/lvzuanshi_liuguang2_17": {
            "width": 58,
            "height": 54
          },
          "lvzuanshi_liuguang2/lvzuanshi_liuguang2_18": {
            "width": 58,
            "height": 54
          },
          "lvzuanshi_liuguang2/lvzuanshi_liuguang2_19": {
            "width": 58,
            "height": 54
          },
          "lvzuanshi_liuguang2/lvzuanshi_liuguang2_20": {
            "width": 58,
            "height": 54
          },
          "lvzuanshi_liuguang2/lvzuanshi_liuguang2_21": {
            "width": 58,
            "height": 54
          },
          "lvzuanshi_liuguang2/lvzuanshi_liuguang2_22": {
            "width": 58,
            "height": 54
          },
          "lvzuanshi_liuguang2/lvzuanshi_liuguang2_23": {
            "width": 58,
            "height": 54
          },
          "lvzuanshi_liuguang2/lvzuanshi_liuguang2_24": {
            "width": 58,
            "height": 54
          }
        }
      }
    },
    "animations": {
      "animation1": {
        "slots": {
          "gaoliang01": {
            "color": [
              {
                "time": 0,
                "color": "ffffffff",
                "curve": [
                  0.25,
                  0,
                  0.75,
                  1
                ]
              },
              {
                "time": 0.1667,
                "color": "ffffff00"
              }
            ],
            "attachment": [
              {
                "time": 0,
                "name": null
              }
            ]
          },
          "gaoliang1": {
            "color": [
              {
                "time": 0,
                "color": "ffffffff",
                "curve": [
                  0.25,
                  0,
                  0.75,
                  1
                ]
              },
              {
                "time": 0.1667,
                "color": "ffca00ff",
                "curve": [
                  0.25,
                  0,
                  0.75,
                  1
                ]
              },
              {
                "time": 0.3333,
                "color": "ffffff00"
              }
            ],
            "attachment": [
              {
                "time": 0,
                "name": null
              }
            ]
          },
          "gaoliang2": {
            "color": [
              {
                "time": 0,
                "color": "ffffffff"
              },
              {
                "time": 0.1667,
                "color": "ffca00ff"
              },
              {
                "time": 0.3333,
                "color": "ffffff00"
              }
            ],
            "attachment": [
              {
                "time": 0,
                "name": null
              }
            ]
          },
          "gaoliang02": {
            "color": [
              {
                "time": 0,
                "color": "ffffffff"
              },
              {
                "time": 0.1667,
                "color": "ffffff00"
              }
            ],
            "attachment": [
              {
                "time": 0,
                "name": null
              }
            ]
          },
          "gaoliang3": {
            "color": [
              {
                "time": 0,
                "color": "ffffffff"
              },
              {
                "time": 0.1667,
                "color": "ffca00ff"
              },
              {
                "time": 0.4667,
                "color": "ffffff00"
              }
            ]
          },
          "gaoliang03": {
            "color": [
              {
                "time": 0,
                "color": "ffffffff"
              },
              {
                "time": 0.1667,
                "color": "ffffff00"
              }
            ]
          },
          "guangci01": {
            "color": [
              {
                "time": 0,
                "color": "ffffffff",
                "curve": "stepped"
              },
              {
                "time": 0.5,
                "color": "ffffffff"
              },
              {
                "time": 0.8667,
                "color": "ffffff00"
              }
            ]
          },
          "guangci1": {
            "color": [
              {
                "time": 0,
                "color": "ffffffff",
                "curve": "stepped"
              },
              {
                "time": 0.5,
                "color": "ffffffff"
              },
              {
                "time": 0.8667,
                "color": "ffffff00"
              }
            ]
          },
          "hong": {
            "attachment": [
              {
                "time": 0,
                "name": "lv"
              }
            ]
          },
          "hongzuanshi_liuguang1/hongzuanshi_liuguang1_1": {
            "attachment": [
              {
                "time": 0,
                "name": null
              }
            ]
          },
          "hongzuanshi_liuguang2/hongzuanshi_liuguang2_1": {
            "attachment": [
              {
                "time": 0,
                "name": null
              }
            ]
          },
          "lanzuanshi_liuguang1/lanzuanshi_liuguang1_1": {
            "attachment": [
              {
                "time": 0,
                "name": null
              }
            ]
          },
          "lanzuanshi_liuguang2/lanzuanshi_liuguang2_1": {
            "attachment": [
              {
                "time": 0,
                "name": null
              }
            ]
          },
          "lvzuanshi_liuguang1/lvzuanshi_liuguang1_1": {
            "color": [
              {
                "time": 0,
                "color": "ffffffa8"
              }
            ],
            "attachment": [
              {
                "time": 0,
                "name": null
              },
              {
                "time": 0.2333,
                "name": "lvzuanshi_liuguang1/lvzuanshi_liuguang1_1"
              },
              {
                "time": 0.2667,
                "name": "lvzuanshi_liuguang1/lvzuanshi_liuguang1_2"
              },
              {
                "time": 0.3,
                "name": "lvzuanshi_liuguang1/lvzuanshi_liuguang1_3"
              },
              {
                "time": 0.3333,
                "name": "lvzuanshi_liuguang1/lvzuanshi_liuguang1_4"
              },
              {
                "time": 0.3667,
                "name": "lvzuanshi_liuguang1/lvzuanshi_liuguang1_5"
              },
              {
                "time": 0.4,
                "name": "lvzuanshi_liuguang1/lvzuanshi_liuguang1_6"
              },
              {
                "time": 0.4333,
                "name": "lvzuanshi_liuguang1/lvzuanshi_liuguang1_7"
              },
              {
                "time": 0.4667,
                "name": "lvzuanshi_liuguang1/lvzuanshi_liuguang1_8"
              },
              {
                "time": 0.5,
                "name": "lvzuanshi_liuguang1/lvzuanshi_liuguang1_9"
              },
              {
                "time": 0.5333,
                "name": "lvzuanshi_liuguang1/lvzuanshi_liuguang1_10"
              },
              {
                "time": 0.5667,
                "name": "lvzuanshi_liuguang1/lvzuanshi_liuguang1_11"
              },
              {
                "time": 0.6,
                "name": "lvzuanshi_liuguang1/lvzuanshi_liuguang1_12"
              },
              {
                "time": 0.6333,
                "name": "lvzuanshi_liuguang1/lvzuanshi_liuguang1_13"
              },
              {
                "time": 0.6667,
                "name": "lvzuanshi_liuguang1/lvzuanshi_liuguang1_14"
              },
              {
                "time": 0.7,
                "name": "lvzuanshi_liuguang1/lvzuanshi_liuguang1_15"
              },
              {
                "time": 0.7333,
                "name": "lvzuanshi_liuguang1/lvzuanshi_liuguang1_16"
              },
              {
                "time": 0.7667,
                "name": null
              }
            ]
          },
          "lvzuanshi_liuguang2/lvzuanshi_liuguang2_1": {
            "attachment": [
              {
                "time": 0,
                "name": null
              },
              {
                "time": 0.0667,
                "name": "lvzuanshi_liuguang2/lvzuanshi_liuguang2_1"
              },
              {
                "time": 0.1,
                "name": "lvzuanshi_liuguang2/lvzuanshi_liuguang2_2"
              },
              {
                "time": 0.1333,
                "name": "lvzuanshi_liuguang2/lvzuanshi_liuguang2_3"
              },
              {
                "time": 0.1667,
                "name": "lvzuanshi_liuguang2/lvzuanshi_liuguang2_4"
              },
              {
                "time": 0.2,
                "name": "lvzuanshi_liuguang2/lvzuanshi_liuguang2_5"
              },
              {
                "time": 0.2333,
                "name": "lvzuanshi_liuguang2/lvzuanshi_liuguang2_6"
              },
              {
                "time": 0.2667,
                "name": "lvzuanshi_liuguang2/lvzuanshi_liuguang2_7"
              },
              {
                "time": 0.3,
                "name": "lvzuanshi_liuguang2/lvzuanshi_liuguang2_8"
              },
              {
                "time": 0.3333,
                "name": "lvzuanshi_liuguang2/lvzuanshi_liuguang2_9"
              },
              {
                "time": 0.3667,
                "name": "lvzuanshi_liuguang2/lvzuanshi_liuguang2_10"
              },
              {
                "time": 0.4,
                "name": "lvzuanshi_liuguang2/lvzuanshi_liuguang2_11"
              },
              {
                "time": 0.4333,
                "name": "lvzuanshi_liuguang2/lvzuanshi_liuguang2_12"
              },
              {
                "time": 0.4667,
                "name": "lvzuanshi_liuguang2/lvzuanshi_liuguang2_13"
              },
              {
                "time": 0.5,
                "name": "lvzuanshi_liuguang2/lvzuanshi_liuguang2_14"
              },
              {
                "time": 0.5333,
                "name": "lvzuanshi_liuguang2/lvzuanshi_liuguang2_15"
              },
              {
                "time": 0.5667,
                "name": "lvzuanshi_liuguang2/lvzuanshi_liuguang2_16"
              },
              {
                "time": 0.6,
                "name": "lvzuanshi_liuguang2/lvzuanshi_liuguang2_17"
              },
              {
                "time": 0.6333,
                "name": "lvzuanshi_liuguang2/lvzuanshi_liuguang2_18"
              },
              {
                "time": 0.6667,
                "name": "lvzuanshi_liuguang2/lvzuanshi_liuguang2_19"
              },
              {
                "time": 0.7,
                "name": "lvzuanshi_liuguang2/lvzuanshi_liuguang2_20"
              },
              {
                "time": 0.7333,
                "name": "lvzuanshi_liuguang2/lvzuanshi_liuguang2_21"
              },
              {
                "time": 0.7667,
                "name": "lvzuanshi_liuguang2/lvzuanshi_liuguang2_22"
              },
              {
                "time": 0.8,
                "name": "lvzuanshi_liuguang2/lvzuanshi_liuguang2_23"
              },
              {
                "time": 0.8333,
                "name": "lvzuanshi_liuguang2/lvzuanshi_liuguang2_24"
              },
              {
                "time": 0.8667,
                "name": null
              }
            ]
          }
        },
        "bones": {
          "hong": {
            "scale": [
              {
                "time": 0,
                "x": 0,
                "y": 0
              },
              {
                "time": 0.1667,
                "x": 1.2,
                "y": 1.2
              },
              {
                "time": 0.5,
                "x": 0.8,
                "y": 0.8
              }
            ]
          },
          "guangci01": {
            "rotate": [
              {
                "time": 0,
                "angle": 0,
                "curve": [
                  0,
                  0.16,
                  0.75,
                  1
                ]
              },
              {
                "time": 0.8667,
                "angle": -50
              }
            ]
          },
          "guangci1": {
            "rotate": [
              {
                "time": 0,
                "angle": 0,
                "curve": [
                  0,
                  0.22,
                  0.75,
                  1
                ]
              },
              {
                "time": 0.8667,
                "angle": 50
              }
            ]
          },
          "lvxulie": {
            "scale": [
              {
                "time": 0,
                "x": 1.18,
                "y": 1.18
              }
            ]
          }
        }
      },
      "animation2": {
        "slots": {
          "gaoliang01": {
            "color": [
              {
                "time": 0,
                "color": "ffffffff",
                "curve": [
                  0.25,
                  0,
                  0.75,
                  1
                ]
              },
              {
                "time": 0.1667,
                "color": "ffffff00"
              }
            ],
            "attachment": [
              {
                "time": 0,
                "name": null
              }
            ]
          },
          "gaoliang1": {
            "color": [
              {
                "time": 0,
                "color": "ffffffff",
                "curve": [
                  0.25,
                  0,
                  0.75,
                  1
                ]
              },
              {
                "time": 0.1667,
                "color": "ffca00ff",
                "curve": [
                  0.25,
                  0,
                  0.75,
                  1
                ]
              },
              {
                "time": 0.3333,
                "color": "ffffff00"
              }
            ],
            "attachment": [
              {
                "time": 0,
                "name": null
              }
            ]
          },
          "gaoliang2": {
            "color": [
              {
                "time": 0,
                "color": "ffffffff"
              },
              {
                "time": 0.1667,
                "color": "ffca00ff"
              },
              {
                "time": 0.3333,
                "color": "ffffff00"
              }
            ]
          },
          "gaoliang02": {
            "color": [
              {
                "time": 0,
                "color": "ffffffff"
              },
              {
                "time": 0.1667,
                "color": "ffffff00"
              }
            ]
          },
          "gaoliang3": {
            "attachment": [
              {
                "time": 0,
                "name": null
              }
            ]
          },
          "gaoliang03": {
            "attachment": [
              {
                "time": 0,
                "name": null
              }
            ]
          },
          "guangci01": {
            "color": [
              {
                "time": 0,
                "color": "ffffffff",
                "curve": "stepped"
              },
              {
                "time": 0.5,
                "color": "ffffffff"
              },
              {
                "time": 0.8667,
                "color": "ffffff00"
              }
            ]
          },
          "guangci1": {
            "color": [
              {
                "time": 0,
                "color": "ffffffff",
                "curve": "stepped"
              },
              {
                "time": 0.5,
                "color": "ffffffff"
              },
              {
                "time": 0.8667,
                "color": "ffffff00"
              }
            ]
          },
          "hong": {
            "attachment": [
              {
                "time": 0,
                "name": "lan"
              }
            ]
          },
          "hongzuanshi_liuguang1/hongzuanshi_liuguang1_1": {
            "attachment": [
              {
                "time": 0,
                "name": null
              }
            ]
          },
          "hongzuanshi_liuguang2/hongzuanshi_liuguang2_1": {
            "attachment": [
              {
                "time": 0,
                "name": null
              }
            ]
          },
          "lanzuanshi_liuguang1/lanzuanshi_liuguang1_1": {
            "color": [
              {
                "time": 0,
                "color": "ed54ffff"
              }
            ],
            "attachment": [
              {
                "time": 0,
                "name": null
              },
              {
                "time": 0.2333,
                "name": "lanzuanshi_liuguang1/lanzuanshi_liuguang1_1"
              },
              {
                "time": 0.2667,
                "name": "lanzuanshi_liuguang1/lanzuanshi_liuguang1_2"
              },
              {
                "time": 0.3,
                "name": "lanzuanshi_liuguang1/lanzuanshi_liuguang1_3"
              },
              {
                "time": 0.3333,
                "name": "lanzuanshi_liuguang1/lanzuanshi_liuguang1_4"
              },
              {
                "time": 0.3667,
                "name": "lanzuanshi_liuguang1/lanzuanshi_liuguang1_5"
              },
              {
                "time": 0.4,
                "name": "lanzuanshi_liuguang1/lanzuanshi_liuguang1_6"
              },
              {
                "time": 0.4333,
                "name": "lanzuanshi_liuguang1/lanzuanshi_liuguang1_7"
              },
              {
                "time": 0.4667,
                "name": "lanzuanshi_liuguang1/lanzuanshi_liuguang1_8"
              },
              {
                "time": 0.5,
                "name": "lanzuanshi_liuguang1/lanzuanshi_liuguang1_9"
              },
              {
                "time": 0.5333,
                "name": "lanzuanshi_liuguang1/lanzuanshi_liuguang1_10"
              },
              {
                "time": 0.5667,
                "name": "lanzuanshi_liuguang1/lanzuanshi_liuguang1_11"
              },
              {
                "time": 0.6,
                "name": "lanzuanshi_liuguang1/lanzuanshi_liuguang1_12"
              },
              {
                "time": 0.6333,
                "name": "lanzuanshi_liuguang1/lanzuanshi_liuguang1_13"
              },
              {
                "time": 0.6667,
                "name": "lanzuanshi_liuguang1/lanzuanshi_liuguang1_14"
              },
              {
                "time": 0.7,
                "name": "lanzuanshi_liuguang1/lanzuanshi_liuguang1_15"
              },
              {
                "time": 0.7333,
                "name": "lanzuanshi_liuguang1/lanzuanshi_liuguang1_16"
              },
              {
                "time": 0.7667,
                "name": "lanzuanshi_liuguang1/lanzuanshi_liuguang1_17"
              },
              {
                "time": 0.8,
                "name": "lanzuanshi_liuguang1/lanzuanshi_liuguang1_18"
              },
              {
                "time": 0.8333,
                "name": "lanzuanshi_liuguang1/lanzuanshi_liuguang1_19"
              },
              {
                "time": 0.8667,
                "name": null
              }
            ]
          },
          "lanzuanshi_liuguang2/lanzuanshi_liuguang2_1": {
            "color": [
              {
                "time": 0,
                "color": "ed54ffff"
              }
            ],
            "attachment": [
              {
                "time": 0,
                "name": null
              },
              {
                "time": 0.0667,
                "name": "lanzuanshi_liuguang2/lanzuanshi_liuguang2_1"
              },
              {
                "time": 0.1,
                "name": "lanzuanshi_liuguang2/lanzuanshi_liuguang2_2"
              },
              {
                "time": 0.1333,
                "name": "lanzuanshi_liuguang2/lanzuanshi_liuguang2_3"
              },
              {
                "time": 0.1667,
                "name": "lanzuanshi_liuguang2/lanzuanshi_liuguang2_4"
              },
              {
                "time": 0.2,
                "name": "lanzuanshi_liuguang2/lanzuanshi_liuguang2_5"
              },
              {
                "time": 0.2333,
                "name": "lanzuanshi_liuguang2/lanzuanshi_liuguang2_6"
              },
              {
                "time": 0.2667,
                "name": "lanzuanshi_liuguang2/lanzuanshi_liuguang2_7"
              },
              {
                "time": 0.3,
                "name": "lanzuanshi_liuguang2/lanzuanshi_liuguang2_8"
              },
              {
                "time": 0.3333,
                "name": "lanzuanshi_liuguang2/lanzuanshi_liuguang2_9"
              },
              {
                "time": 0.3667,
                "name": "lanzuanshi_liuguang2/lanzuanshi_liuguang2_10"
              },
              {
                "time": 0.4,
                "name": "lanzuanshi_liuguang2/lanzuanshi_liuguang2_11"
              },
              {
                "time": 0.4333,
                "name": "lanzuanshi_liuguang2/lanzuanshi_liuguang2_12"
              },
              {
                "time": 0.4667,
                "name": "lanzuanshi_liuguang2/lanzuanshi_liuguang2_13"
              },
              {
                "time": 0.5,
                "name": "lanzuanshi_liuguang2/lanzuanshi_liuguang2_14"
              },
              {
                "time": 0.5333,
                "name": "lanzuanshi_liuguang2/lanzuanshi_liuguang2_15"
              },
              {
                "time": 0.5667,
                "name": "lanzuanshi_liuguang2/lanzuanshi_liuguang2_16"
              },
              {
                "time": 0.6,
                "name": "lanzuanshi_liuguang2/lanzuanshi_liuguang2_17"
              },
              {
                "time": 0.6333,
                "name": "lanzuanshi_liuguang2/lanzuanshi_liuguang2_18"
              },
              {
                "time": 0.6667,
                "name": "lanzuanshi_liuguang2/lanzuanshi_liuguang2_19"
              },
              {
                "time": 0.7,
                "name": "lanzuanshi_liuguang2/lanzuanshi_liuguang2_20"
              },
              {
                "time": 0.7333,
                "name": "lanzuanshi_liuguang2/lanzuanshi_liuguang2_21"
              },
              {
                "time": 0.7667,
                "name": "lanzuanshi_liuguang2/lanzuanshi_liuguang2_22"
              },
              {
                "time": 0.8,
                "name": "lanzuanshi_liuguang2/lanzuanshi_liuguang2_23"
              },
              {
                "time": 0.8333,
                "name": "lanzuanshi_liuguang2/lanzuanshi_liuguang2_24"
              },
              {
                "time": 0.8667,
                "name": null
              }
            ]
          },
          "lvzuanshi_liuguang1/lvzuanshi_liuguang1_1": {
            "attachment": [
              {
                "time": 0,
                "name": null
              }
            ]
          },
          "lvzuanshi_liuguang2/lvzuanshi_liuguang2_1": {
            "attachment": [
              {
                "time": 0,
                "name": null
              }
            ]
          }
        },
        "bones": {
          "hong": {
            "scale": [
              {
                "time": 0,
                "x": 0,
                "y": 0
              },
              {
                "time": 0.1667,
                "x": 1.2,
                "y": 1.2
              },
              {
                "time": 0.5,
                "x": 0.8,
                "y": 0.8
              }
            ]
          },
          "guangci01": {
            "rotate": [
              {
                "time": 0,
                "angle": 0,
                "curve": [
                  0,
                  0.16,
                  0.75,
                  1
                ]
              },
              {
                "time": 0.8667,
                "angle": -50
              }
            ]
          },
          "guangci1": {
            "rotate": [
              {
                "time": 0,
                "angle": 0,
                "curve": [
                  0,
                  0.22,
                  0.75,
                  1
                ]
              },
              {
                "time": 0.8667,
                "angle": 50
              }
            ]
          },
          "lanxulie": {
            "scale": [
              {
                "time": 0,
                "x": 1.305,
                "y": 1.305
              }
            ]
          }
        }
      },
      "animation3": {
        "slots": {
          "gaoliang01": {
            "color": [
              {
                "time": 0,
                "color": "ffffffff",
                "curve": [
                  0.25,
                  0,
                  0.75,
                  1
                ]
              },
              {
                "time": 0.1667,
                "color": "ffffff00"
              }
            ]
          },
          "gaoliang1": {
            "color": [
              {
                "time": 0,
                "color": "ffffffff",
                "curve": [
                  0.25,
                  0,
                  0.75,
                  1
                ]
              },
              {
                "time": 0.1667,
                "color": "ffca00ff",
                "curve": [
                  0.25,
                  0,
                  0.75,
                  1
                ]
              },
              {
                "time": 0.3333,
                "color": "ffffff00"
              }
            ]
          },
          "gaoliang02": {
            "attachment": [
              {
                "time": 0,
                "name": null
              }
            ]
          },
          "gaoliang2": {
            "attachment": [
              {
                "time": 0,
                "name": null
              }
            ]
          },
          "gaoliang3": {
            "attachment": [
              {
                "time": 0,
                "name": null
              }
            ]
          },
          "gaoliang03": {
            "attachment": [
              {
                "time": 0,
                "name": null
              }
            ]
          },
          "guangci01": {
            "color": [
              {
                "time": 0,
                "color": "ffffffff",
                "curve": "stepped"
              },
              {
                "time": 0.5,
                "color": "ffffffff"
              },
              {
                "time": 0.8667,
                "color": "ffffff00"
              }
            ]
          },
          "guangci1": {
            "color": [
              {
                "time": 0,
                "color": "ffffffff",
                "curve": "stepped"
              },
              {
                "time": 0.5,
                "color": "ffffffff"
              },
              {
                "time": 0.8667,
                "color": "ffffff00"
              }
            ]
          },
          "hongzuanshi_liuguang1/hongzuanshi_liuguang1_1": {
            "attachment": [
              {
                "time": 0,
                "name": null
              },
              {
                "time": 0.2333,
                "name": "hongzuanshi_liuguang1/hongzuanshi_liuguang1_1"
              },
              {
                "time": 0.2667,
                "name": "hongzuanshi_liuguang1/hongzuanshi_liuguang1_2"
              },
              {
                "time": 0.3,
                "name": "hongzuanshi_liuguang1/hongzuanshi_liuguang1_3"
              },
              {
                "time": 0.3333,
                "name": "hongzuanshi_liuguang1/hongzuanshi_liuguang1_4"
              },
              {
                "time": 0.3667,
                "name": "hongzuanshi_liuguang1/hongzuanshi_liuguang1_5"
              },
              {
                "time": 0.4,
                "name": "hongzuanshi_liuguang1/hongzuanshi_liuguang1_6"
              },
              {
                "time": 0.4333,
                "name": "hongzuanshi_liuguang1/hongzuanshi_liuguang1_7"
              },
              {
                "time": 0.4667,
                "name": "hongzuanshi_liuguang1/hongzuanshi_liuguang1_8"
              },
              {
                "time": 0.5,
                "name": "hongzuanshi_liuguang1/hongzuanshi_liuguang1_9"
              },
              {
                "time": 0.5333,
                "name": "hongzuanshi_liuguang1/hongzuanshi_liuguang1_10"
              },
              {
                "time": 0.5667,
                "name": "hongzuanshi_liuguang1/hongzuanshi_liuguang1_11"
              },
              {
                "time": 0.6,
                "name": "hongzuanshi_liuguang1/hongzuanshi_liuguang1_12"
              },
              {
                "time": 0.6333,
                "name": "hongzuanshi_liuguang1/hongzuanshi_liuguang1_13"
              },
              {
                "time": 0.6667,
                "name": "hongzuanshi_liuguang1/hongzuanshi_liuguang1_14"
              },
              {
                "time": 0.7,
                "name": "hongzuanshi_liuguang1/hongzuanshi_liuguang1_15"
              },
              {
                "time": 0.7333,
                "name": "hongzuanshi_liuguang1/hongzuanshi_liuguang1_16"
              },
              {
                "time": 0.7667,
                "name": "hongzuanshi_liuguang1/hongzuanshi_liuguang1_17"
              },
              {
                "time": 0.8,
                "name": "hongzuanshi_liuguang1/hongzuanshi_liuguang1_18"
              },
              {
                "time": 0.8333,
                "name": "hongzuanshi_liuguang1/hongzuanshi_liuguang1_19"
              },
              {
                "time": 0.8667,
                "name": null
              }
            ]
          },
          "hongzuanshi_liuguang2/hongzuanshi_liuguang2_1": {
            "attachment": [
              {
                "time": 0,
                "name": null
              },
              {
                "time": 0.0667,
                "name": "hongzuanshi_liuguang2/hongzuanshi_liuguang2_1"
              },
              {
                "time": 0.1,
                "name": "hongzuanshi_liuguang2/hongzuanshi_liuguang2_2"
              },
              {
                "time": 0.1333,
                "name": "hongzuanshi_liuguang2/hongzuanshi_liuguang2_3"
              },
              {
                "time": 0.1667,
                "name": "hongzuanshi_liuguang2/hongzuanshi_liuguang2_4"
              },
              {
                "time": 0.2,
                "name": "hongzuanshi_liuguang2/hongzuanshi_liuguang2_5"
              },
              {
                "time": 0.2333,
                "name": "hongzuanshi_liuguang2/hongzuanshi_liuguang2_6"
              },
              {
                "time": 0.2667,
                "name": "hongzuanshi_liuguang2/hongzuanshi_liuguang2_7"
              },
              {
                "time": 0.3,
                "name": "hongzuanshi_liuguang2/hongzuanshi_liuguang2_8"
              },
              {
                "time": 0.3333,
                "name": "hongzuanshi_liuguang2/hongzuanshi_liuguang2_9"
              },
              {
                "time": 0.3667,
                "name": "hongzuanshi_liuguang2/hongzuanshi_liuguang2_10"
              },
              {
                "time": 0.4,
                "name": "hongzuanshi_liuguang2/hongzuanshi_liuguang2_11"
              },
              {
                "time": 0.4333,
                "name": "hongzuanshi_liuguang2/hongzuanshi_liuguang2_12"
              },
              {
                "time": 0.4667,
                "name": "hongzuanshi_liuguang2/hongzuanshi_liuguang2_13"
              },
              {
                "time": 0.5,
                "name": "hongzuanshi_liuguang2/hongzuanshi_liuguang2_14"
              },
              {
                "time": 0.5333,
                "name": "hongzuanshi_liuguang2/hongzuanshi_liuguang2_15"
              },
              {
                "time": 0.5667,
                "name": "hongzuanshi_liuguang2/hongzuanshi_liuguang2_16"
              },
              {
                "time": 0.6,
                "name": "hongzuanshi_liuguang2/hongzuanshi_liuguang2_17"
              },
              {
                "time": 0.6333,
                "name": "hongzuanshi_liuguang2/hongzuanshi_liuguang2_18"
              },
              {
                "time": 0.6667,
                "name": "hongzuanshi_liuguang2/hongzuanshi_liuguang2_19"
              },
              {
                "time": 0.7,
                "name": "hongzuanshi_liuguang2/hongzuanshi_liuguang2_20"
              },
              {
                "time": 0.7333,
                "name": "hongzuanshi_liuguang2/hongzuanshi_liuguang2_21"
              },
              {
                "time": 0.7667,
                "name": "hongzuanshi_liuguang2/hongzuanshi_liuguang2_22"
              },
              {
                "time": 0.8,
                "name": "hongzuanshi_liuguang2/hongzuanshi_liuguang2_23"
              },
              {
                "time": 0.8333,
                "name": "hongzuanshi_liuguang2/hongzuanshi_liuguang2_24"
              },
              {
                "time": 0.8667,
                "name": null
              }
            ]
          },
          "lanzuanshi_liuguang1/lanzuanshi_liuguang1_1": {
            "attachment": [
              {
                "time": 0,
                "name": null
              }
            ]
          },
          "lanzuanshi_liuguang2/lanzuanshi_liuguang2_1": {
            "attachment": [
              {
                "time": 0,
                "name": null
              }
            ]
          },
          "lvzuanshi_liuguang1/lvzuanshi_liuguang1_1": {
            "attachment": [
              {
                "time": 0,
                "name": null
              }
            ]
          },
          "lvzuanshi_liuguang2/lvzuanshi_liuguang2_1": {
            "attachment": [
              {
                "time": 0,
                "name": null
              }
            ]
          }
        },
        "bones": {
          "hong": {
            "scale": [
              {
                "time": 0,
                "x": 0,
                "y": 0
              },
              {
                "time": 0.1667,
                "x": 1.2,
                "y": 1.2
              },
              {
                "time": 0.5,
                "x": 0.8,
                "y": 0.8
              }
            ]
          },
          "guangci01": {
            "rotate": [
              {
                "time": 0,
                "angle": 0,
                "curve": [
                  0,
                  0.16,
                  0.75,
                  1
                ]
              },
              {
                "time": 0.8667,
                "angle": -50
              }
            ]
          },
          "guangci1": {
            "rotate": [
              {
                "time": 0,
                "angle": 0,
                "curve": [
                  0,
                  0.22,
                  0.75,
                  1
                ]
              },
              {
                "time": 0.8667,
                "angle": 50
              }
            ]
          },
          "hongxulie": {
            "scale": [
              {
                "time": 0,
                "x": 0.982,
                "y": 0.982
              }
            ]
          }
        }
      },
      "animation1_1": {
        "slots": {
          "gaoliang01": {
            "color": [
              {
                "time": 0,
                "color": "ffffff00"
              },
              {
                "time": 0.0667,
                "color": "ffffff76",
                "curve": "stepped"
              },
              {
                "time": 0.2,
                "color": "ffffff76"
              },
              {
                "time": 0.5,
                "color": "ffffff00"
              },
              {
                "time": 0.5667,
                "color": "ff0000ff"
              },
              {
                "time": 0.8333,
                "color": "ffffff00"
              }
            ],
            "attachment": [
              {
                "time": 0,
                "name": null
              }
            ]
          },
          "gaoliang1": {
            "color": [
              {
                "time": 0,
                "color": "ffffff00"
              },
              {
                "time": 0.0667,
                "color": "ff930476"
              },
              {
                "time": 0.2,
                "color": "ffffff76"
              },
              {
                "time": 0.5,
                "color": "ffffff00"
              },
              {
                "time": 0.5667,
                "color": "ffffffff"
              },
              {
                "time": 0.8333,
                "color": "ffffff00"
              }
            ],
            "attachment": [
              {
                "time": 0,
                "name": null
              }
            ]
          },
          "gaoliang02": {
            "color": [
              {
                "time": 0,
                "color": "ff930476"
              },
              {
                "time": 0.2,
                "color": "ffffff76"
              },
              {
                "time": 0.5,
                "color": "ffffff00"
              },
              {
                "time": 0.5667,
                "color": "00a3ffff"
              },
              {
                "time": 0.8333,
                "color": "ffffff00"
              }
            ],
            "attachment": [
              {
                "time": 0,
                "name": null
              }
            ]
          },
          "gaoliang2": {
            "color": [
              {
                "time": 0,
                "color": "ff930476"
              },
              {
                "time": 0.2,
                "color": "ffffff76"
              },
              {
                "time": 0.5,
                "color": "ffffff00"
              },
              {
                "time": 0.5667,
                "color": "ffffffff"
              },
              {
                "time": 0.8333,
                "color": "ffffff00"
              }
            ],
            "attachment": [
              {
                "time": 0,
                "name": null
              }
            ]
          },
          "gaoliang3": {
            "color": [
              {
                "time": 0,
                "color": "dcff0376"
              },
              {
                "time": 0.2,
                "color": "ffffff76"
              },
              {
                "time": 0.5,
                "color": "ffffff00"
              },
              {
                "time": 0.5667,
                "color": "89ff00ff"
              },
              {
                "time": 0.8333,
                "color": "ffffff00"
              }
            ],
            "attachment": [
              {
                "time": 0,
                "name": "gaoliang03"
              }
            ]
          },
          "gaoliang03": {
            "color": [
              {
                "time": 0,
                "color": "c2ff0376"
              },
              {
                "time": 0.2,
                "color": "ffffff76"
              },
              {
                "time": 0.5,
                "color": "ffffff00"
              },
              {
                "time": 0.5667,
                "color": "8cff45ff"
              },
              {
                "time": 0.8333,
                "color": "ffffff00"
              }
            ],
            "attachment": [
              {
                "time": 0,
                "name": "gaoliang03"
              }
            ]
          },
          "guangci01": {
            "attachment": [
              {
                "time": 0,
                "name": null
              }
            ]
          },
          "guangci1": {
            "attachment": [
              {
                "time": 0,
                "name": null
              }
            ]
          },
          "hong": {
            "color": [
              {
                "time": 0,
                "color": "ffffffff",
                "curve": "stepped"
              },
              {
                "time": 0.5,
                "color": "ffffffff"
              },
              {
                "time": 0.6667,
                "color": "ffffff00"
              }
            ],
            "attachment": [
              {
                "time": 0,
                "name": "lv"
              }
            ]
          },
          "hongzuanshi_liuguang1/hongzuanshi_liuguang1_1": {
            "attachment": [
              {
                "time": 0,
                "name": null
              }
            ]
          },
          "hongzuanshi_liuguang2/hongzuanshi_liuguang2_1": {
            "attachment": [
              {
                "time": 0,
                "name": null
              }
            ]
          },
          "lanzuanshi_liuguang1/lanzuanshi_liuguang1_1": {
            "attachment": [
              {
                "time": 0,
                "name": null
              }
            ]
          },
          "lanzuanshi_liuguang2/lanzuanshi_liuguang2_1": {
            "attachment": [
              {
                "time": 0,
                "name": null
              }
            ]
          },
          "lvzuanshi_liuguang1/lvzuanshi_liuguang1_1": {
            "attachment": [
              {
                "time": 0,
                "name": null
              }
            ]
          },
          "lvzuanshi_liuguang2/lvzuanshi_liuguang2_1": {
            "attachment": [
              {
                "time": 0,
                "name": null
              }
            ]
          }
        },
        "bones": {
          "hong": {
            "scale": [
              {
                "time": 0,
                "x": 0.8,
                "y": 0.8
              },
              {
                "time": 0.2667,
                "x": 1.5,
                "y": 1.5
              },
              {
                "time": 0.5,
                "x": 0.624,
                "y": 0.624
              }
            ]
          },
          "lvxulie": {
            "scale": [
              {
                "time": 0,
                "x": 1.081,
                "y": 1.081
              }
            ]
          }
        }
      },
      "animation2_1": {
        "slots": {
          "gaoliang01": {
            "color": [
              {
                "time": 0,
                "color": "ffffff00"
              },
              {
                "time": 0.0667,
                "color": "ffffff76",
                "curve": "stepped"
              },
              {
                "time": 0.2,
                "color": "ffffff76"
              },
              {
                "time": 0.5,
                "color": "ffffff00"
              },
              {
                "time": 0.5667,
                "color": "ff0000ff"
              },
              {
                "time": 0.8333,
                "color": "ffffff00"
              }
            ],
            "attachment": [
              {
                "time": 0,
                "name": null
              }
            ]
          },
          "gaoliang1": {
            "color": [
              {
                "time": 0,
                "color": "ffffff00"
              },
              {
                "time": 0.0667,
                "color": "ff930476"
              },
              {
                "time": 0.2,
                "color": "ffffff76"
              },
              {
                "time": 0.5,
                "color": "ffffff00"
              },
              {
                "time": 0.5667,
                "color": "ffffffff"
              },
              {
                "time": 0.8333,
                "color": "ffffff00"
              }
            ],
            "attachment": [
              {
                "time": 0,
                "name": null
              }
            ]
          },
          "gaoliang02": {
            "color": [
              {
                "time": 0,
                "color": "ff930476"
              },
              {
                "time": 0.2,
                "color": "ffffff76"
              },
              {
                "time": 0.5,
                "color": "ffffff00"
              },
              {
                "time": 0.5667,
                "color": "00a3ffff"
              },
              {
                "time": 0.8333,
                "color": "ffffff00"
              }
            ],
            "attachment": [
              {
                "time": 0,
                "name": "gaoliang02"
              }
            ]
          },
          "gaoliang2": {
            "color": [
              {
                "time": 0,
                "color": "ff930476"
              },
              {
                "time": 0.2,
                "color": "ffffff76"
              },
              {
                "time": 0.5,
                "color": "ffffff00"
              },
              {
                "time": 0.5667,
                "color": "70e4ffff"
              },
              {
                "time": 0.8333,
                "color": "ffffff00"
              }
            ],
            "attachment": [
              {
                "time": 0,
                "name": "gaoliang02"
              }
            ]
          },
          "gaoliang03": {
            "attachment": [
              {
                "time": 0,
                "name": null
              }
            ]
          },
          "gaoliang3": {
            "attachment": [
              {
                "time": 0,
                "name": null
              }
            ]
          },
          "guangci01": {
            "attachment": [
              {
                "time": 0,
                "name": null
              }
            ]
          },
          "guangci1": {
            "attachment": [
              {
                "time": 0,
                "name": null
              }
            ]
          },
          "hong": {
            "color": [
              {
                "time": 0,
                "color": "ffffffff",
                "curve": "stepped"
              },
              {
                "time": 0.5,
                "color": "ffffffff"
              },
              {
                "time": 0.6667,
                "color": "ffffff00"
              }
            ],
            "attachment": [
              {
                "time": 0,
                "name": "lan"
              }
            ]
          },
          "hongzuanshi_liuguang1/hongzuanshi_liuguang1_1": {
            "attachment": [
              {
                "time": 0,
                "name": null
              }
            ]
          },
          "hongzuanshi_liuguang2/hongzuanshi_liuguang2_1": {
            "attachment": [
              {
                "time": 0,
                "name": null
              }
            ]
          },
          "lanzuanshi_liuguang1/lanzuanshi_liuguang1_1": {
            "attachment": [
              {
                "time": 0,
                "name": null
              }
            ]
          },
          "lanzuanshi_liuguang2/lanzuanshi_liuguang2_1": {
            "attachment": [
              {
                "time": 0,
                "name": null
              }
            ]
          },
          "lvzuanshi_liuguang1/lvzuanshi_liuguang1_1": {
            "attachment": [
              {
                "time": 0,
                "name": null
              }
            ]
          },
          "lvzuanshi_liuguang2/lvzuanshi_liuguang2_1": {
            "attachment": [
              {
                "time": 0,
                "name": null
              }
            ]
          }
        },
        "bones": {
          "hong": {
            "scale": [
              {
                "time": 0,
                "x": 0.8,
                "y": 0.8
              },
              {
                "time": 0.2667,
                "x": 1.5,
                "y": 1.5
              },
              {
                "time": 0.5,
                "x": 0.624,
                "y": 0.624
              }
            ]
          },
          "lanxulie": {
            "scale": [
              {
                "time": 0,
                "x": 1.295,
                "y": 1.295
              }
            ]
          }
        }
      },
      "animation3_1": {
        "slots": {
          "gaoliang01": {
            "color": [
              {
                "time": 0,
                "color": "ffffff76",
                "curve": "stepped"
              },
              {
                "time": 0.2,
                "color": "ffffff76"
              },
              {
                "time": 0.5,
                "color": "ffffff00"
              },
              {
                "time": 0.5667,
                "color": "ff0000ff"
              },
              {
                "time": 0.8333,
                "color": "ffffff00"
              }
            ]
          },
          "gaoliang1": {
            "color": [
              {
                "time": 0,
                "color": "ff930476"
              },
              {
                "time": 0.2,
                "color": "ffffff76"
              },
              {
                "time": 0.5,
                "color": "ffffff00"
              },
              {
                "time": 0.5667,
                "color": "ffffffff"
              },
              {
                "time": 0.8333,
                "color": "ffffff00"
              }
            ]
          },
          "gaoliang2": {
            "attachment": [
              {
                "time": 0,
                "name": null
              }
            ]
          },
          "gaoliang02": {
            "attachment": [
              {
                "time": 0,
                "name": null
              }
            ]
          },
          "gaoliang03": {
            "attachment": [
              {
                "time": 0,
                "name": null
              }
            ]
          },
          "gaoliang3": {
            "attachment": [
              {
                "time": 0,
                "name": null
              }
            ]
          },
          "guangci01": {
            "attachment": [
              {
                "time": 0,
                "name": null
              }
            ]
          },
          "guangci1": {
            "attachment": [
              {
                "time": 0,
                "name": null
              }
            ]
          },
          "hong": {
            "color": [
              {
                "time": 0,
                "color": "ffffffff",
                "curve": "stepped"
              },
              {
                "time": 0.5,
                "color": "ffffffff"
              },
              {
                "time": 0.6667,
                "color": "ffffff00"
              }
            ]
          },
          "hongzuanshi_liuguang1/hongzuanshi_liuguang1_1": {
            "attachment": [
              {
                "time": 0,
                "name": null
              }
            ]
          },
          "hongzuanshi_liuguang2/hongzuanshi_liuguang2_1": {
            "attachment": [
              {
                "time": 0,
                "name": null
              }
            ]
          },
          "lanzuanshi_liuguang1/lanzuanshi_liuguang1_1": {
            "attachment": [
              {
                "time": 0,
                "name": null
              }
            ]
          },
          "lanzuanshi_liuguang2/lanzuanshi_liuguang2_1": {
            "attachment": [
              {
                "time": 0,
                "name": null
              }
            ]
          },
          "lvzuanshi_liuguang1/lvzuanshi_liuguang1_1": {
            "attachment": [
              {
                "time": 0,
                "name": null
              }
            ]
          },
          "lvzuanshi_liuguang2/lvzuanshi_liuguang2_1": {
            "attachment": [
              {
                "time": 0,
                "name": null
              }
            ]
          }
        },
        "bones": {
          "hong": {
            "scale": [
              {
                "time": 0,
                "x": 0.8,
                "y": 0.8
              },
              {
                "time": 0.2667,
                "x": 1.5,
                "y": 1.5
              },
              {
                "time": 0.5,
                "x": 0.624,
                "y": 0.624
              }
            ]
          }
        }
      }
    }
  },
  "_atlasText": "\nzhuanshi_01.png\nsize: 699,699\nformat: RGBA8888\nfilter: Linear,Linear\nrepeat: none\ngaoliang01\n  rotate: false\n  xy: 313, 602\n  size: 100, 97\n  orig: 100, 97\n  offset: 0, 0\n  index: -1\ngaoliang02\n  rotate: false\n  xy: 0, 131\n  size: 98, 97\n  orig: 98, 97\n  offset: 0, 0\n  index: -1\ngaoliang03\n  rotate: false\n  xy: 415, 611\n  size: 90, 88\n  orig: 90, 88\n  offset: 0, 0\n  index: -1\nguangci01\n  rotate: false\n  xy: 0, 515\n  size: 155, 184\n  orig: 155, 184\n  offset: 0, 0\n  index: -1\nhong\n  rotate: true\n  xy: 0, 356\n  size: 157, 152\n  orig: 157, 152\n  offset: 0, 0\n  index: -1\nhongzuanshi_liuguang1/hongzuanshi_liuguang1_1\n  rotate: false\n  xy: 366, 165\n  size: 38, 45\n  orig: 58, 54\n  offset: 2, 8\n  index: -1\nhongzuanshi_liuguang1/hongzuanshi_liuguang1_10\n  rotate: true\n  xy: 111, 75\n  size: 54, 52\n  orig: 58, 54\n  offset: 2, 1\n  index: -1\nhongzuanshi_liuguang1/hongzuanshi_liuguang1_11\n  rotate: true\n  xy: 111, 19\n  size: 54, 52\n  orig: 58, 54\n  offset: 2, 1\n  index: -1\nhongzuanshi_liuguang1/hongzuanshi_liuguang1_12\n  rotate: true\n  xy: 488, 427\n  size: 53, 52\n  orig: 58, 54\n  offset: 3, 1\n  index: -1\nhongzuanshi_liuguang1/hongzuanshi_liuguang1_13\n  rotate: false\n  xy: 542, 482\n  size: 53, 52\n  orig: 58, 54\n  offset: 3, 1\n  index: -1\nhongzuanshi_liuguang1/hongzuanshi_liuguang1_14\n  rotate: false\n  xy: 515, 274\n  size: 51, 52\n  orig: 58, 54\n  offset: 5, 1\n  index: -1\nhongzuanshi_liuguang1/hongzuanshi_liuguang1_15\n  rotate: false\n  xy: 652, 483\n  size: 47, 51\n  orig: 58, 54\n  offset: 9, 1\n  index: -1\nhongzuanshi_liuguang1/hongzuanshi_liuguang1_16\n  rotate: false\n  xy: 165, 82\n  size: 43, 50\n  orig: 58, 54\n  offset: 13, 1\n  index: -1\nhongzuanshi_liuguang1/hongzuanshi_liuguang1_17\n  rotate: false\n  xy: 609, 116\n  size: 40, 47\n  orig: 58, 54\n  offset: 16, 2\n  index: -1\nhongzuanshi_liuguang1/hongzuanshi_liuguang1_18\n  rotate: true\n  xy: 215, 28\n  size: 34, 42\n  orig: 58, 54\n  offset: 22, 2\n  index: -1\nhongzuanshi_liuguang1/hongzuanshi_liuguang1_19\n  rotate: true\n  xy: 215, 28\n  size: 34, 42\n  orig: 58, 54\n  offset: 22, 2\n  index: -1\nhongzuanshi_liuguang1/hongzuanshi_liuguang1_2\n  rotate: false\n  xy: 215, 64\n  size: 42, 48\n  orig: 58, 54\n  offset: 2, 5\n  index: -1\nhongzuanshi_liuguang1/hongzuanshi_liuguang1_3\n  rotate: false\n  xy: 652, 431\n  size: 47, 50\n  orig: 58, 54\n  offset: 2, 3\n  index: -1\nhongzuanshi_liuguang1/hongzuanshi_liuguang1_4\n  rotate: false\n  xy: 568, 215\n  size: 51, 51\n  orig: 58, 54\n  offset: 2, 2\n  index: -1\nhongzuanshi_liuguang1/hongzuanshi_liuguang1_5\n  rotate: true\n  xy: 271, 491\n  size: 52, 51\n  orig: 58, 54\n  offset: 2, 2\n  index: -1\nhongzuanshi_liuguang1/hongzuanshi_liuguang1_6\n  rotate: true\n  xy: 57, 19\n  size: 53, 52\n  orig: 58, 54\n  offset: 2, 1\n  index: -1\nhongzuanshi_liuguang1/hongzuanshi_liuguang1_7\n  rotate: true\n  xy: 370, 546\n  size: 54, 52\n  orig: 58, 54\n  offset: 2, 1\n  index: -1\nhongzuanshi_liuguang1/hongzuanshi_liuguang1_8\n  rotate: true\n  xy: 380, 490\n  size: 54, 52\n  orig: 58, 54\n  offset: 2, 1\n  index: -1\nhongzuanshi_liuguang1/hongzuanshi_liuguang1_9\n  rotate: true\n  xy: 100, 174\n  size: 54, 52\n  orig: 58, 54\n  offset: 2, 1\n  index: -1\nhongzuanshi_liuguang2/hongzuanshi_liuguang2_1\n  rotate: false\n  xy: 515, 220\n  size: 51, 52\n  orig: 58, 54\n  offset: 4, 1\n  index: -1\nhongzuanshi_liuguang2/hongzuanshi_liuguang2_10\n  rotate: false\n  xy: 378, 379\n  size: 54, 53\n  orig: 58, 54\n  offset: 2, 0\n  index: -1\nhongzuanshi_liuguang2/hongzuanshi_liuguang2_11\n  rotate: true\n  xy: 406, 323\n  size: 54, 53\n  orig: 58, 54\n  offset: 2, 0\n  index: -1\nhongzuanshi_liuguang2/hongzuanshi_liuguang2_12\n  rotate: false\n  xy: 154, 435\n  size: 54, 54\n  orig: 58, 54\n  offset: 2, 0\n  index: -1\nhongzuanshi_liuguang2/hongzuanshi_liuguang2_13\n  rotate: false\n  xy: 154, 379\n  size: 54, 54\n  orig: 58, 54\n  offset: 2, 0\n  index: -1\nhongzuanshi_liuguang2/hongzuanshi_liuguang2_14\n  rotate: true\n  xy: 406, 267\n  size: 54, 53\n  orig: 58, 54\n  offset: 2, 0\n  index: -1\nhongzuanshi_liuguang2/hongzuanshi_liuguang2_15\n  rotate: false\n  xy: 182, 212\n  size: 54, 53\n  orig: 58, 54\n  offset: 2, 0\n  index: -1\nhongzuanshi_liuguang2/hongzuanshi_liuguang2_16\n  rotate: false\n  xy: 157, 491\n  size: 55, 52\n  orig: 58, 54\n  offset: 1, 1\n  index: -1\nhongzuanshi_liuguang2/hongzuanshi_liuguang2_17\n  rotate: false\n  xy: 214, 491\n  size: 55, 52\n  orig: 58, 54\n  offset: 1, 1\n  index: -1\nhongzuanshi_liuguang2/hongzuanshi_liuguang2_18\n  rotate: true\n  xy: 434, 498\n  size: 55, 52\n  orig: 58, 54\n  offset: 1, 1\n  index: -1\nhongzuanshi_liuguang2/hongzuanshi_liuguang2_19\n  rotate: true\n  xy: 434, 441\n  size: 55, 52\n  orig: 58, 54\n  offset: 1, 1\n  index: -1\nhongzuanshi_liuguang2/hongzuanshi_liuguang2_2\n  rotate: false\n  xy: 542, 428\n  size: 53, 52\n  orig: 58, 54\n  offset: 3, 1\n  index: -1\nhongzuanshi_liuguang2/hongzuanshi_liuguang2_20\n  rotate: true\n  xy: 434, 384\n  size: 55, 52\n  orig: 58, 54\n  offset: 1, 1\n  index: -1\nhongzuanshi_liuguang2/hongzuanshi_liuguang2_21\n  rotate: true\n  xy: 461, 328\n  size: 54, 52\n  orig: 58, 54\n  offset: 2, 1\n  index: -1\nhongzuanshi_liuguang2/hongzuanshi_liuguang2_22\n  rotate: true\n  xy: 461, 272\n  size: 54, 52\n  orig: 58, 54\n  offset: 2, 1\n  index: -1\nhongzuanshi_liuguang2/hongzuanshi_liuguang2_23\n  rotate: false\n  xy: 597, 482\n  size: 53, 52\n  orig: 58, 54\n  offset: 2, 1\n  index: -1\nhongzuanshi_liuguang2/hongzuanshi_liuguang2_24\n  rotate: false\n  xy: 568, 323\n  size: 51, 52\n  orig: 58, 54\n  offset: 3, 1\n  index: -1\nhongzuanshi_liuguang2/hongzuanshi_liuguang2_3\n  rotate: true\n  xy: 128, 300\n  size: 54, 52\n  orig: 58, 54\n  offset: 2, 1\n  index: -1\nhongzuanshi_liuguang2/hongzuanshi_liuguang2_4\n  rotate: true\n  xy: 128, 244\n  size: 54, 52\n  orig: 58, 54\n  offset: 2, 1\n  index: -1\nhongzuanshi_liuguang2/hongzuanshi_liuguang2_5\n  rotate: true\n  xy: 57, 74\n  size: 55, 52\n  orig: 58, 54\n  offset: 2, 1\n  index: -1\nhongzuanshi_liuguang2/hongzuanshi_liuguang2_6\n  rotate: false\n  xy: 507, 591\n  size: 55, 52\n  orig: 58, 54\n  offset: 2, 1\n  index: -1\nhongzuanshi_liuguang2/hongzuanshi_liuguang2_7\n  rotate: false\n  xy: 564, 591\n  size: 55, 52\n  orig: 58, 54\n  offset: 2, 1\n  index: -1\nhongzuanshi_liuguang2/hongzuanshi_liuguang2_8\n  rotate: false\n  xy: 621, 591\n  size: 55, 52\n  orig: 58, 54\n  offset: 2, 1\n  index: -1\nhongzuanshi_liuguang2/hongzuanshi_liuguang2_9\n  rotate: false\n  xy: 324, 491\n  size: 54, 53\n  orig: 58, 54\n  offset: 2, 0\n  index: -1\nlan\n  rotate: false\n  xy: 157, 545\n  size: 154, 154\n  orig: 154, 154\n  offset: 0, 0\n  index: -1\nlanzuanshi_liuguang1/lanzuanshi_liuguang1_1\n  rotate: false\n  xy: 537, 384\n  size: 37, 41\n  orig: 58, 54\n  offset: 2, 12\n  index: -1\nlanzuanshi_liuguang1/lanzuanshi_liuguang1_10\n  rotate: false\n  xy: 266, 435\n  size: 54, 54\n  orig: 58, 54\n  offset: 2, 0\n  index: -1\nlanzuanshi_liuguang1/lanzuanshi_liuguang1_11\n  rotate: true\n  xy: 350, 212\n  size: 53, 54\n  orig: 58, 54\n  offset: 3, 0\n  index: -1\nlanzuanshi_liuguang1/lanzuanshi_liuguang1_12\n  rotate: false\n  xy: 406, 211\n  size: 53, 54\n  orig: 58, 54\n  offset: 3, 0\n  index: -1\nlanzuanshi_liuguang1/lanzuanshi_liuguang1_13\n  rotate: false\n  xy: 461, 216\n  size: 52, 54\n  orig: 58, 54\n  offset: 4, 0\n  index: -1\nlanzuanshi_liuguang1/lanzuanshi_liuguang1_14\n  rotate: false\n  xy: 568, 268\n  size: 50, 53\n  orig: 58, 54\n  offset: 6, 0\n  index: -1\nlanzuanshi_liuguang1/lanzuanshi_liuguang1_15\n  rotate: true\n  xy: 154, 166\n  size: 44, 53\n  orig: 58, 54\n  offset: 12, 0\n  index: -1\nlanzuanshi_liuguang1/lanzuanshi_liuguang1_16\n  rotate: true\n  xy: 100, 131\n  size: 41, 50\n  orig: 58, 54\n  offset: 15, 0\n  index: -1\nlanzuanshi_liuguang1/lanzuanshi_liuguang1_17\n  rotate: false\n  xy: 366, 118\n  size: 38, 45\n  orig: 58, 54\n  offset: 18, 1\n  index: -1\nlanzuanshi_liuguang1/lanzuanshi_liuguang1_18\n  rotate: false\n  xy: 620, 280\n  size: 34, 41\n  orig: 58, 54\n  offset: 22, 1\n  index: -1\nlanzuanshi_liuguang1/lanzuanshi_liuguang1_19\n  rotate: false\n  xy: 620, 280\n  size: 34, 41\n  orig: 58, 54\n  offset: 22, 1\n  index: -1\nlanzuanshi_liuguang1/lanzuanshi_liuguang1_2\n  rotate: true\n  xy: 488, 384\n  size: 41, 47\n  orig: 58, 54\n  offset: 2, 7\n  index: -1\nlanzuanshi_liuguang1/lanzuanshi_liuguang1_3\n  rotate: true\n  xy: 209, 165\n  size: 45, 51\n  orig: 58, 54\n  offset: 2, 3\n  index: -1\nlanzuanshi_liuguang1/lanzuanshi_liuguang1_4\n  rotate: true\n  xy: 576, 377\n  size: 49, 53\n  orig: 58, 54\n  offset: 2, 1\n  index: -1\nlanzuanshi_liuguang1/lanzuanshi_liuguang1_5\n  rotate: true\n  xy: 597, 428\n  size: 52, 53\n  orig: 58, 54\n  offset: 2, 1\n  index: -1\nlanzuanshi_liuguang1/lanzuanshi_liuguang1_6\n  rotate: true\n  xy: 238, 212\n  size: 53, 54\n  orig: 58, 54\n  offset: 2, 0\n  index: -1\nlanzuanshi_liuguang1/lanzuanshi_liuguang1_7\n  rotate: true\n  xy: 294, 212\n  size: 53, 54\n  orig: 58, 54\n  offset: 2, 0\n  index: -1\nlanzuanshi_liuguang1/lanzuanshi_liuguang1_8\n  rotate: false\n  xy: 210, 435\n  size: 54, 54\n  orig: 58, 54\n  offset: 2, 0\n  index: -1\nlanzuanshi_liuguang1/lanzuanshi_liuguang1_9\n  rotate: false\n  xy: 210, 379\n  size: 54, 54\n  orig: 58, 54\n  offset: 2, 0\n  index: -1\nlanzuanshi_liuguang2/lanzuanshi_liuguang2_1\n  rotate: true\n  xy: 507, 538\n  size: 51, 54\n  orig: 58, 54\n  offset: 4, 0\n  index: -1\nlanzuanshi_liuguang2/lanzuanshi_liuguang2_10\n  rotate: false\n  xy: 322, 435\n  size: 54, 54\n  orig: 58, 54\n  offset: 2, 0\n  index: -1\nlanzuanshi_liuguang2/lanzuanshi_liuguang2_11\n  rotate: false\n  xy: 322, 379\n  size: 54, 54\n  orig: 58, 54\n  offset: 2, 0\n  index: -1\nlanzuanshi_liuguang2/lanzuanshi_liuguang2_12\n  rotate: false\n  xy: 378, 434\n  size: 54, 54\n  orig: 58, 54\n  offset: 2, 0\n  index: -1\nlanzuanshi_liuguang2/lanzuanshi_liuguang2_13\n  rotate: false\n  xy: 182, 323\n  size: 54, 54\n  orig: 58, 54\n  offset: 2, 0\n  index: -1\nlanzuanshi_liuguang2/lanzuanshi_liuguang2_14\n  rotate: false\n  xy: 182, 267\n  size: 54, 54\n  orig: 58, 54\n  offset: 2, 0\n  index: -1\nlanzuanshi_liuguang2/lanzuanshi_liuguang2_15\n  rotate: false\n  xy: 238, 323\n  size: 54, 54\n  orig: 58, 54\n  offset: 2, 0\n  index: -1\nlanzuanshi_liuguang2/lanzuanshi_liuguang2_16\n  rotate: false\n  xy: 238, 267\n  size: 54, 54\n  orig: 58, 54\n  offset: 2, 0\n  index: -1\nlanzuanshi_liuguang2/lanzuanshi_liuguang2_17\n  rotate: false\n  xy: 294, 323\n  size: 54, 54\n  orig: 58, 54\n  offset: 2, 0\n  index: -1\nlanzuanshi_liuguang2/lanzuanshi_liuguang2_18\n  rotate: false\n  xy: 621, 645\n  size: 55, 54\n  orig: 58, 54\n  offset: 1, 0\n  index: -1\nlanzuanshi_liuguang2/lanzuanshi_liuguang2_19\n  rotate: false\n  xy: 424, 555\n  size: 55, 54\n  orig: 58, 54\n  offset: 1, 0\n  index: -1\nlanzuanshi_liuguang2/lanzuanshi_liuguang2_2\n  rotate: true\n  xy: 563, 536\n  size: 53, 54\n  orig: 58, 54\n  offset: 3, 0\n  index: -1\nlanzuanshi_liuguang2/lanzuanshi_liuguang2_20\n  rotate: false\n  xy: 294, 267\n  size: 54, 54\n  orig: 58, 54\n  offset: 2, 0\n  index: -1\nlanzuanshi_liuguang2/lanzuanshi_liuguang2_21\n  rotate: false\n  xy: 350, 323\n  size: 54, 54\n  orig: 58, 54\n  offset: 2, 0\n  index: -1\nlanzuanshi_liuguang2/lanzuanshi_liuguang2_22\n  rotate: false\n  xy: 350, 267\n  size: 54, 54\n  orig: 58, 54\n  offset: 2, 0\n  index: -1\nlanzuanshi_liuguang2/lanzuanshi_liuguang2_23\n  rotate: false\n  xy: 488, 482\n  size: 52, 54\n  orig: 58, 54\n  offset: 3, 0\n  index: -1\nlanzuanshi_liuguang2/lanzuanshi_liuguang2_24\n  rotate: false\n  xy: 515, 328\n  size: 51, 54\n  orig: 58, 54\n  offset: 3, 0\n  index: -1\nlanzuanshi_liuguang2/lanzuanshi_liuguang2_3\n  rotate: true\n  xy: 619, 536\n  size: 53, 54\n  orig: 58, 54\n  offset: 3, 0\n  index: -1\nlanzuanshi_liuguang2/lanzuanshi_liuguang2_4\n  rotate: false\n  xy: 266, 379\n  size: 54, 54\n  orig: 58, 54\n  offset: 2, 0\n  index: -1\nlanzuanshi_liuguang2/lanzuanshi_liuguang2_5\n  rotate: false\n  xy: 313, 546\n  size: 55, 54\n  orig: 58, 54\n  offset: 2, 0\n  index: -1\nlanzuanshi_liuguang2/lanzuanshi_liuguang2_6\n  rotate: false\n  xy: 0, 75\n  size: 55, 54\n  orig: 58, 54\n  offset: 2, 0\n  index: -1\nlanzuanshi_liuguang2/lanzuanshi_liuguang2_7\n  rotate: false\n  xy: 507, 645\n  size: 55, 54\n  orig: 58, 54\n  offset: 2, 0\n  index: -1\nlanzuanshi_liuguang2/lanzuanshi_liuguang2_8\n  rotate: false\n  xy: 0, 19\n  size: 55, 54\n  orig: 58, 54\n  offset: 2, 0\n  index: -1\nlanzuanshi_liuguang2/lanzuanshi_liuguang2_9\n  rotate: false\n  xy: 564, 645\n  size: 55, 54\n  orig: 58, 54\n  offset: 2, 0\n  index: -1\nlv\n  rotate: false\n  xy: 0, 230\n  size: 126, 124\n  orig: 126, 124\n  offset: 0, 0\n  index: -1\nlvzuanshi_liuguang1/lvzuanshi_liuguang1_1\n  rotate: false\n  xy: 154, 359\n  size: 14, 18\n  orig: 58, 54\n  offset: 5, 31\n  index: -1\nlvzuanshi_liuguang1/lvzuanshi_liuguang1_10\n  rotate: false\n  xy: 512, 166\n  size: 48, 48\n  orig: 58, 54\n  offset: 6, 3\n  index: -1\nlvzuanshi_liuguang1/lvzuanshi_liuguang1_11\n  rotate: false\n  xy: 565, 66\n  size: 46, 48\n  orig: 58, 54\n  offset: 8, 3\n  index: -1\nlvzuanshi_liuguang1/lvzuanshi_liuguang1_12\n  rotate: false\n  xy: 613, 67\n  size: 41, 47\n  orig: 58, 54\n  offset: 13, 3\n  index: -1\nlvzuanshi_liuguang1/lvzuanshi_liuguang1_13\n  rotate: false\n  xy: 614, 18\n  size: 39, 47\n  orig: 58, 54\n  offset: 15, 3\n  index: -1\nlvzuanshi_liuguang1/lvzuanshi_liuguang1_14\n  rotate: false\n  xy: 621, 232\n  size: 35, 46\n  orig: 58, 54\n  offset: 19, 3\n  index: -1\nlvzuanshi_liuguang1/lvzuanshi_liuguang1_15\n  rotate: true\n  xy: 152, 134\n  size: 30, 43\n  orig: 58, 54\n  offset: 23, 4\n  index: -1\nlvzuanshi_liuguang1/lvzuanshi_liuguang1_16\n  rotate: false\n  xy: 481, 572\n  size: 24, 37\n  orig: 58, 54\n  offset: 29, 6\n  index: -1\nlvzuanshi_liuguang1/lvzuanshi_liuguang1_2\n  rotate: false\n  xy: 678, 674\n  size: 21, 25\n  orig: 58, 54\n  offset: 5, 25\n  index: -1\nlvzuanshi_liuguang1/lvzuanshi_liuguang1_3\n  rotate: true\n  xy: 165, 0\n  size: 28, 31\n  orig: 58, 54\n  offset: 4, 20\n  index: -1\nlvzuanshi_liuguang1/lvzuanshi_liuguang1_4\n  rotate: false\n  xy: 658, 244\n  size: 34, 37\n  orig: 58, 54\n  offset: 4, 14\n  index: -1\nlvzuanshi_liuguang1/lvzuanshi_liuguang1_5\n  rotate: true\n  xy: 656, 283\n  size: 40, 43\n  orig: 58, 54\n  offset: 4, 8\n  index: -1\nlvzuanshi_liuguang1/lvzuanshi_liuguang1_6\n  rotate: false\n  xy: 566, 18\n  size: 46, 46\n  orig: 58, 54\n  offset: 4, 5\n  index: -1\nlvzuanshi_liuguang1/lvzuanshi_liuguang1_7\n  rotate: false\n  xy: 415, 8\n  size: 49, 48\n  orig: 58, 54\n  offset: 4, 4\n  index: -1\nlvzuanshi_liuguang1/lvzuanshi_liuguang1_8\n  rotate: false\n  xy: 509, 116\n  size: 48, 48\n  orig: 58, 54\n  offset: 5, 3\n  index: -1\nlvzuanshi_liuguang1/lvzuanshi_liuguang1_9\n  rotate: false\n  xy: 461, 166\n  size: 49, 48\n  orig: 58, 54\n  offset: 5, 3\n  index: -1\nlvzuanshi_liuguang2/lvzuanshi_liuguang2_1\n  rotate: false\n  xy: 652, 381\n  size: 47, 48\n  orig: 58, 54\n  offset: 6, 3\n  index: -1\nlvzuanshi_liuguang2/lvzuanshi_liuguang2_10\n  rotate: false\n  xy: 262, 111\n  size: 50, 49\n  orig: 58, 54\n  offset: 4, 2\n  index: -1\nlvzuanshi_liuguang2/lvzuanshi_liuguang2_11\n  rotate: false\n  xy: 314, 111\n  size: 50, 49\n  orig: 58, 54\n  offset: 4, 2\n  index: -1\nlvzuanshi_liuguang2/lvzuanshi_liuguang2_12\n  rotate: false\n  xy: 406, 110\n  size: 50, 49\n  orig: 58, 54\n  offset: 4, 2\n  index: -1\nlvzuanshi_liuguang2/lvzuanshi_liuguang2_13\n  rotate: false\n  xy: 259, 60\n  size: 50, 49\n  orig: 58, 54\n  offset: 4, 2\n  index: -1\nlvzuanshi_liuguang2/lvzuanshi_liuguang2_14\n  rotate: false\n  xy: 311, 60\n  size: 50, 49\n  orig: 58, 54\n  offset: 4, 2\n  index: -1\nlvzuanshi_liuguang2/lvzuanshi_liuguang2_15\n  rotate: false\n  xy: 259, 9\n  size: 50, 49\n  orig: 58, 54\n  offset: 4, 2\n  index: -1\nlvzuanshi_liuguang2/lvzuanshi_liuguang2_16\n  rotate: false\n  xy: 311, 10\n  size: 50, 48\n  orig: 58, 54\n  offset: 4, 3\n  index: -1\nlvzuanshi_liuguang2/lvzuanshi_liuguang2_17\n  rotate: true\n  xy: 621, 325\n  size: 50, 48\n  orig: 58, 54\n  offset: 4, 3\n  index: -1\nlvzuanshi_liuguang2/lvzuanshi_liuguang2_18\n  rotate: false\n  xy: 363, 60\n  size: 50, 48\n  orig: 58, 54\n  offset: 4, 3\n  index: -1\nlvzuanshi_liuguang2/lvzuanshi_liuguang2_19\n  rotate: false\n  xy: 363, 10\n  size: 50, 48\n  orig: 58, 54\n  offset: 4, 3\n  index: -1\nlvzuanshi_liuguang2/lvzuanshi_liuguang2_2\n  rotate: false\n  xy: 458, 116\n  size: 49, 48\n  orig: 58, 54\n  offset: 5, 3\n  index: -1\nlvzuanshi_liuguang2/lvzuanshi_liuguang2_20\n  rotate: true\n  xy: 415, 58\n  size: 50, 48\n  orig: 58, 54\n  offset: 4, 3\n  index: -1\nlvzuanshi_liuguang2/lvzuanshi_liuguang2_21\n  rotate: true\n  xy: 515, 65\n  size: 49, 48\n  orig: 58, 54\n  offset: 4, 3\n  index: -1\nlvzuanshi_liuguang2/lvzuanshi_liuguang2_22\n  rotate: true\n  xy: 516, 14\n  size: 49, 48\n  orig: 58, 54\n  offset: 4, 3\n  index: -1\nlvzuanshi_liuguang2/lvzuanshi_liuguang2_23\n  rotate: false\n  xy: 562, 165\n  size: 49, 48\n  orig: 58, 54\n  offset: 4, 3\n  index: -1\nlvzuanshi_liuguang2/lvzuanshi_liuguang2_24\n  rotate: true\n  xy: 559, 116\n  size: 47, 48\n  orig: 58, 54\n  offset: 5, 3\n  index: -1\nlvzuanshi_liuguang2/lvzuanshi_liuguang2_3\n  rotate: true\n  xy: 465, 65\n  size: 49, 48\n  orig: 58, 54\n  offset: 5, 3\n  index: -1\nlvzuanshi_liuguang2/lvzuanshi_liuguang2_4\n  rotate: true\n  xy: 466, 14\n  size: 49, 48\n  orig: 58, 54\n  offset: 5, 3\n  index: -1\nlvzuanshi_liuguang2/lvzuanshi_liuguang2_5\n  rotate: false\n  xy: 262, 162\n  size: 50, 48\n  orig: 58, 54\n  offset: 4, 3\n  index: -1\nlvzuanshi_liuguang2/lvzuanshi_liuguang2_6\n  rotate: false\n  xy: 314, 162\n  size: 50, 48\n  orig: 58, 54\n  offset: 4, 3\n  index: -1\nlvzuanshi_liuguang2/lvzuanshi_liuguang2_7\n  rotate: false\n  xy: 406, 161\n  size: 50, 48\n  orig: 58, 54\n  offset: 4, 3\n  index: -1\nlvzuanshi_liuguang2/lvzuanshi_liuguang2_8\n  rotate: true\n  xy: 165, 30\n  size: 50, 48\n  orig: 58, 54\n  offset: 4, 3\n  index: -1\nlvzuanshi_liuguang2/lvzuanshi_liuguang2_9\n  rotate: false\n  xy: 210, 114\n  size: 50, 49\n  orig: 58, 54\n  offset: 4, 2\n  index: -1\n",
  "textures": [
    {
      "__uuid__": "9aaFLZvHdMrbzFwwhh//LG"
    }
  ],
  "textureNames": [
    "zhuanshi_01.png"
  ]
}