{
  "__type__": "sp.SkeletonData",
  "_name": "skeleton",
  "_skeletonJson": {
    "skeleton": {
      "hash": "QftF+tr5W6NV1OdsgrkigHtPsi8",
      "spine": "3.6.53",
      "width": 0,
      "height": 0,
      "images": "./img/"
    },
    "bones": [
      {
        "name": "root"
      },
      {
        "name": "k",
        "parent": "root"
      }
    ],
    "slots": [
      {
        "name": "7",
        "bone": "root"
      },
      {
        "name": "k",
        "bone": "k"
      },
      {
        "name": "k2",
        "bone": "k",
        "blend": "additive"
      }
    ],
    "skins": {
      "default": {
        "k": {
          "effect_Socre_JungleKingpin_win_01": {
            "width": 138,
            "height": 112
          },
          "effect_Socre_JungleKingpin_win_03": {
            "width": 133,
            "height": 114
          },
          "effect_Socre_JungleKingpin_win_05": {
            "width": 134,
            "height": 117
          },
          "effect_Socre_JungleKingpin_win_07": {
            "width": 139,
            "height": 115
          },
          "effect_Socre_JungleKingpin_win_09": {
            "width": 140,
            "height": 113
          },
          "effect_Socre_JungleKingpin_win_11": {
            "width": 139,
            "height": 113
          },
          "effect_Socre_JungleKingpin_win_13": {
            "width": 136,
            "height": 115
          },
          "effect_Socre_JungleKingpin_win_15": {
            "width": 133,
            "height": 115
          },
          "effect_Socre_JungleKingpin_win_17": {
            "width": 137,
            "height": 112
          },
          "effect_Socre_JungleKingpin_win_19": {
            "width": 139,
            "height": 115
          }
        },
        "k2": {
          "effect_Socre_JungleKingpin_win_01": {
            "width": 138,
            "height": 112
          },
          "effect_Socre_JungleKingpin_win_03": {
            "width": 133,
            "height": 114
          },
          "effect_Socre_JungleKingpin_win_05": {
            "width": 134,
            "height": 117
          },
          "effect_Socre_JungleKingpin_win_07": {
            "width": 139,
            "height": 115
          },
          "effect_Socre_JungleKingpin_win_09": {
            "width": 140,
            "height": 113
          },
          "effect_Socre_JungleKingpin_win_11": {
            "width": 139,
            "height": 113
          },
          "effect_Socre_JungleKingpin_win_13": {
            "width": 136,
            "height": 115
          },
          "effect_Socre_JungleKingpin_win_15": {
            "width": 133,
            "height": 115
          },
          "effect_Socre_JungleKingpin_win_17": {
            "width": 137,
            "height": 112
          },
          "effect_Socre_JungleKingpin_win_19": {
            "width": 139,
            "height": 115
          }
        }
      }
    },
    "animations": {
      "animation": {
        "slots": {
          "k": {
            "attachment": [
              {
                "time": 0,
                "name": "effect_Socre_JungleKingpin_win_01"
              },
              {
                "time": 0.0667,
                "name": "effect_Socre_JungleKingpin_win_03"
              },
              {
                "time": 0.1333,
                "name": "effect_Socre_JungleKingpin_win_05"
              },
              {
                "time": 0.2,
                "name": "effect_Socre_JungleKingpin_win_07"
              },
              {
                "time": 0.2667,
                "name": "effect_Socre_JungleKingpin_win_09"
              },
              {
                "time": 0.3333,
                "name": "effect_Socre_JungleKingpin_win_11"
              },
              {
                "time": 0.4,
                "name": "effect_Socre_JungleKingpin_win_13"
              },
              {
                "time": 0.4667,
                "name": "effect_Socre_JungleKingpin_win_15"
              },
              {
                "time": 0.5333,
                "name": "effect_Socre_JungleKingpin_win_17"
              },
              {
                "time": 0.6,
                "name": "effect_Socre_JungleKingpin_win_19"
              }
            ]
          },
          "k2": {
            "attachment": [
              {
                "time": 0,
                "name": "effect_Socre_JungleKingpin_win_01"
              },
              {
                "time": 0.0667,
                "name": "effect_Socre_JungleKingpin_win_03"
              },
              {
                "time": 0.1333,
                "name": "effect_Socre_JungleKingpin_win_05"
              },
              {
                "time": 0.2,
                "name": "effect_Socre_JungleKingpin_win_07"
              },
              {
                "time": 0.2667,
                "name": "effect_Socre_JungleKingpin_win_09"
              },
              {
                "time": 0.3333,
                "name": "effect_Socre_JungleKingpin_win_11"
              },
              {
                "time": 0.4,
                "name": "effect_Socre_JungleKingpin_win_13"
              },
              {
                "time": 0.4667,
                "name": "effect_Socre_JungleKingpin_win_15"
              },
              {
                "time": 0.5333,
                "name": "effect_Socre_JungleKingpin_win_17"
              },
              {
                "time": 0.6,
                "name": "effect_Socre_JungleKingpin_win_19"
              }
            ]
          }
        },
        "bones": {
          "k": {
            "translate": [
              {
                "time": 0,
                "x": 0,
                "y": -6.38
              }
            ],
            "scale": [
              {
                "time": 0,
                "x": 0.95,
                "y": 0.77
              }
            ]
          }
        }
      }
    }
  },
  "_atlasText": "\nskeleton.png\nsize: 1024,256\nformat: RGBA8888\nfilter: Linear,Linear\nrepeat: none\neffect_Socre_JungleKingpin_win_01\n  rotate: false\n  xy: 665, 116\n  size: 130, 106\n  orig: 138, 112\n  offset: 6, 2\n  index: -1\neffect_Socre_JungleKingpin_win_03\n  rotate: false\n  xy: 797, 113\n  size: 126, 109\n  orig: 133, 114\n  offset: 6, 1\n  index: -1\neffect_Socre_JungleKingpin_win_05\n  rotate: false\n  xy: 534, 113\n  size: 129, 109\n  orig: 134, 117\n  offset: 4, 3\n  index: -1\neffect_Socre_JungleKingpin_win_07\n  rotate: false\n  xy: 269, 113\n  size: 131, 109\n  orig: 139, 115\n  offset: 5, 2\n  index: -1\neffect_Socre_JungleKingpin_win_09\n  rotate: false\n  xy: 2, 113\n  size: 132, 109\n  orig: 140, 113\n  offset: 5, 1\n  index: -1\neffect_Socre_JungleKingpin_win_11\n  rotate: false\n  xy: 136, 2\n  size: 130, 108\n  orig: 139, 113\n  offset: 5, 0\n  index: -1\neffect_Socre_JungleKingpin_win_13\n  rotate: false\n  xy: 665, 5\n  size: 126, 109\n  orig: 136, 115\n  offset: 7, 1\n  index: -1\neffect_Socre_JungleKingpin_win_15\n  rotate: false\n  xy: 402, 113\n  size: 130, 109\n  orig: 133, 115\n  offset: 3, 3\n  index: -1\neffect_Socre_JungleKingpin_win_17\n  rotate: false\n  xy: 2, 2\n  size: 132, 109\n  orig: 137, 112\n  offset: 3, 0\n  index: -1\neffect_Socre_JungleKingpin_win_19\n  rotate: false\n  xy: 136, 112\n  size: 131, 110\n  orig: 139, 115\n  offset: 5, 2\n  index: -1\n",
  "textures": [
    {
      "__uuid__": "7fbMjg4H9GVrw9p/DpENtJ"
    }
  ],
  "textureNames": [
    "skeleton.png"
  ]
}