{"__type__":"sp.SkeletonData","_name":"qiandaichuxian","_skeletonJson":{"skeleton":{"hash":"YfVX1n4KvFs/dulSViPZB50uee0","spine":"3.6.53","width":0,"height":0,"images":"./img/"},"bones":[{"name":"root"},{"name":"ef","parent":"root"},{"name":"骨骼3","parent":"root"}],"slots":[{"name":"theme159takeitbg7_2","bone":"骨骼3","blend":"additive"},{"name":"ef","bone":"ef","blend":"additive"}],"skins":{"default":{"ef":{"ef/dianjilizi/dianjilizi_00":{"width":91,"height":107},"ef/dianjilizi/dianjilizi_01":{"width":105,"height":115},"ef/dianjilizi/dianjilizi_02":{"width":117,"height":123},"ef/dianjilizi/dianjilizi_03":{"width":127,"height":134},"ef/dianjilizi/dianjilizi_04":{"width":136,"height":144},"ef/dianjilizi/dianjilizi_05":{"width":145,"height":152},"ef/dianjilizi/dianjilizi_06":{"width":155,"height":159},"ef/dianjilizi/dianjilizi_07":{"width":163,"height":167},"ef/dianjilizi/dianjilizi_08":{"width":168,"height":175},"ef/dianjilizi/dianjilizi_09":{"width":171,"height":182},"ef/dianjilizi/dianjilizi_10":{"width":175,"height":188},"ef/dianjilizi/dianjilizi_11":{"width":179,"height":192},"ef/dianjilizi/dianjilizi_12":{"width":181,"height":194},"ef/dianjilizi/dianjilizi_13":{"width":180,"height":195},"ef/dianjilizi/dianjilizi_14":{"width":179,"height":194},"ef/dianjilizi/dianjilizi_15":{"width":181,"height":194},"ef/dianjilizi/dianjilizi_16":{"width":181,"height":190},"ef/dianjilizi/dianjilizi_17":{"width":180,"height":186},"ef/dianjilizi/dianjilizi_18":{"width":177,"height":188},"ef/dianjilizi/dianjilizi_19":{"width":165,"height":185},"ef/dianjilizi/dianjilizi_20":{"width":166,"height":179}},"theme159takeitbg7_2":{"qiandaiguang_04":{"width":100,"height":100}}}},"animations":{"animation":{"slots":{"ef":{"attachment":[{"time":0,"name":null},{"time":0.1667,"name":"ef/dianjilizi/dianjilizi_00"},{"time":0.2,"name":"ef/dianjilizi/dianjilizi_02"},{"time":0.2333,"name":"ef/dianjilizi/dianjilizi_04"},{"time":0.2667,"name":"ef/dianjilizi/dianjilizi_05"},{"time":0.3,"name":"ef/dianjilizi/dianjilizi_06"},{"time":0.3333,"name":"ef/dianjilizi/dianjilizi_07"},{"time":0.3667,"name":"ef/dianjilizi/dianjilizi_08"},{"time":0.4,"name":"ef/dianjilizi/dianjilizi_09"},{"time":0.4333,"name":"ef/dianjilizi/dianjilizi_10"},{"time":0.4667,"name":"ef/dianjilizi/dianjilizi_11"},{"time":0.5,"name":"ef/dianjilizi/dianjilizi_12"},{"time":0.5333,"name":"ef/dianjilizi/dianjilizi_13"},{"time":0.5667,"name":"ef/dianjilizi/dianjilizi_14"},{"time":0.6,"name":"ef/dianjilizi/dianjilizi_15"},{"time":0.6333,"name":"ef/dianjilizi/dianjilizi_16"},{"time":0.6667,"name":"ef/dianjilizi/dianjilizi_17"},{"time":0.7,"name":"ef/dianjilizi/dianjilizi_18"},{"time":0.7333,"name":"ef/dianjilizi/dianjilizi_19"},{"time":0.7667,"name":"ef/dianjilizi/dianjilizi_20"},{"time":0.8,"name":null}]},"theme159takeitbg7_2":{"color":[{"time":0,"color":"ffffff00","curve":[0.25,0,0.75,1]},{"time":0.1667,"color":"ffffffff","curve":[0.25,0,0.75,1]},{"time":0.3,"color":"ffffff00"}],"attachment":[{"time":0,"name":"qiandaiguang_04"}]}}}}},"_atlasText":"\nqiandaichuxian.png\nsize: 2048,512\nformat: RGBA8888\nfilter: Linear,Linear\nrepeat: none\nef/dianjilizi/dianjilizi_00\n  rotate: false\n  xy: 109, 10\n  size: 91, 107\n  orig: 91, 107\n  offset: 0, 0\n  index: -1\nef/dianjilizi/dianjilizi_01\n  rotate: false\n  xy: 2, 2\n  size: 105, 115\n  orig: 105, 115\n  offset: 0, 0\n  index: -1\nef/dianjilizi/dianjilizi_02\n  rotate: false\n  xy: 1654, 219\n  size: 117, 123\n  orig: 117, 123\n  offset: 0, 0\n  index: -1\nef/dianjilizi/dianjilizi_03\n  rotate: false\n  xy: 1525, 209\n  size: 127, 134\n  orig: 127, 134\n  offset: 0, 0\n  index: -1\nef/dianjilizi/dianjilizi_04\n  rotate: false\n  xy: 1387, 193\n  size: 136, 144\n  orig: 136, 144\n  offset: 0, 0\n  index: -1\nef/dianjilizi/dianjilizi_05\n  rotate: false\n  xy: 1240, 181\n  size: 145, 152\n  orig: 145, 152\n  offset: 0, 0\n  index: -1\nef/dianjilizi/dianjilizi_06\n  rotate: false\n  xy: 1083, 172\n  size: 155, 159\n  orig: 155, 159\n  offset: 0, 0\n  index: -1\nef/dianjilizi/dianjilizi_07\n  rotate: true\n  xy: 914, 168\n  size: 163, 167\n  orig: 163, 167\n  offset: 0, 0\n  index: -1\nef/dianjilizi/dianjilizi_08\n  rotate: true\n  xy: 1846, 342\n  size: 168, 175\n  orig: 168, 175\n  offset: 0, 0\n  index: -1\nef/dianjilizi/dianjilizi_09\n  rotate: true\n  xy: 1294, 339\n  size: 171, 182\n  orig: 171, 182\n  offset: 0, 0\n  index: -1\nef/dianjilizi/dianjilizi_10\n  rotate: true\n  xy: 1104, 335\n  size: 175, 188\n  orig: 175, 188\n  offset: 0, 0\n  index: -1\nef/dianjilizi/dianjilizi_11\n  rotate: false\n  xy: 368, 318\n  size: 179, 192\n  orig: 179, 192\n  offset: 0, 0\n  index: -1\nef/dianjilizi/dianjilizi_12\n  rotate: false\n  xy: 2, 316\n  size: 181, 194\n  orig: 181, 194\n  offset: 0, 0\n  index: -1\nef/dianjilizi/dianjilizi_13\n  rotate: false\n  xy: 2, 119\n  size: 180, 195\n  orig: 180, 195\n  offset: 0, 0\n  index: -1\nef/dianjilizi/dianjilizi_14\n  rotate: false\n  xy: 184, 120\n  size: 179, 194\n  orig: 179, 194\n  offset: 0, 0\n  index: -1\nef/dianjilizi/dianjilizi_15\n  rotate: false\n  xy: 185, 316\n  size: 181, 194\n  orig: 181, 194\n  offset: 0, 0\n  index: -1\nef/dianjilizi/dianjilizi_16\n  rotate: false\n  xy: 549, 320\n  size: 181, 190\n  orig: 181, 190\n  offset: 0, 0\n  index: -1\nef/dianjilizi/dianjilizi_17\n  rotate: false\n  xy: 732, 324\n  size: 180, 186\n  orig: 180, 186\n  offset: 0, 0\n  index: -1\nef/dianjilizi/dianjilizi_18\n  rotate: true\n  xy: 914, 333\n  size: 177, 188\n  orig: 177, 188\n  offset: 0, 0\n  index: -1\nef/dianjilizi/dianjilizi_19\n  rotate: true\n  xy: 1478, 345\n  size: 165, 185\n  orig: 165, 185\n  offset: 0, 0\n  index: -1\nef/dianjilizi/dianjilizi_20\n  rotate: true\n  xy: 1665, 344\n  size: 166, 179\n  orig: 166, 179\n  offset: 0, 0\n  index: -1\nqiandaiguang_04\n  rotate: false\n  xy: 202, 18\n  size: 100, 100\n  orig: 100, 100\n  offset: 0, 0\n  index: -1\n","textures":[{"__uuid__":"a6KJTsOn5LYZsV6dF65+E2"}],"textureNames":["qiandaichuxian.png"]}